id,tanggal,platform,topik,teks
836,20 hours ago,YouTube,Makan Bergizi Gratis,Sya kepala keluarga  kecil pak Hotman Paris...Setuju di nominalkan saja...biar orang tua yg ngurus
837,20 hours ago,YouTube,Makan Bergizi Gratis,Sehat terus pak Hotman Paris.. emang benar'
838,20 hours ago,YouTube,Makan Bergizi Gratis,"Ada ada aja ini abangku,udah bener dikasih makan gratis bang.bisa menampung banyak tenaga kerja."
839,20 hours ago,YouTube,Makan Bergizi Gratis,Setuju ito yng benar...❤
840,20 hours ago,YouTube,Makan Bergizi Gratis,Rakyat gak butuh bantuan uang maupun MBG Bang Hotman .yang rakyat butuh kan .gratis kan pajak2 murah kn sembako.percuma bang di bantu Uang kalau ujung2 nya semua harga di naikan .
841,20 hours ago,YouTube,Makan Bergizi Gratis,Ini saran yg bagus
842,20 hours ago,YouTube,Makan Bergizi Gratis,"Mantap......ini yg pas,saya dukung pak Hotman Paris,maju terus..... perjuangkan rakyat bawah"
843,20 hours ago,YouTube,Makan Bergizi Gratis,Untuk pendapat Pa Bos yg baik ini sepertinya bakalan di skip....Sehat-sehat terus Pa Bos
844,20 hours ago,YouTube,Makan Bergizi Gratis,Nanti nggak bisa maling
845,20 hours ago,YouTube,Makan Bergizi Gratis,Jgn dungu Hotman kalau Sudah bentuk uang itu uang bisa bayar cicilan pinjaman leasing..liat jugaa emak ema sekarang malas bangun pagi-pagi berangkat sekolah aja pada ribut pada kesiangan
846,20 hours ago,YouTube,Makan Bergizi Gratis,sumpah saya g setuju Ama ide Hotman Paris itu g ngebantu rakyat
847,20 hours ago,YouTube,Makan Bergizi Gratis,saya g setuju Ama ide Hotman paris
848,20 hours ago,YouTube,Makan Bergizi Gratis,jadi rakyat bisa kerja klu ada mbg
849,20 hours ago,YouTube,Makan Bergizi Gratis,sangat sangat setujuuu.... ayo bang suarakan.
850,20 hours ago,YouTube,Makan Bergizi Gratis,udah benar mbg
851,20 hours ago,YouTube,Makan Bergizi Gratis,uang mah udah ada PIP udah ada PKH bpnt
852,20 hours ago,YouTube,Makan Bergizi Gratis,Kali ini saya setuju sama abang  👍🥰
853,20 hours ago,YouTube,Makan Bergizi Gratis,Mantab josssss❤❤❤❤ para pejabat nangis semua setelah ini dapur dapur MBG tutup semua dipakai tempat nikahan saja
854,20 hours ago,YouTube,Makan Bergizi Gratis,"setuju sekali dengan usul bang paris hotman,
sangat pas di ganti uang bantuan.
dari pada pada makanan anak-anak kita gak ada yang mau makan.
ini faktanya.."
855,20 hours ago,YouTube,Makan Bergizi Gratis,mantap setuju bg oman
856,20 hours ago,YouTube,Makan Bergizi Gratis,"Tidak setuju, tetap lanjutkan 


Korupsinya"
857,20 hours ago,YouTube,Makan Bergizi Gratis,Setuju ini baru bener jadi ga ada korupsi.
858,20 hours ago,YouTube,Makan Bergizi Gratis,kehilangankalou mbg  pakey uang orang yangkerja di mbg  nganggur
859,20 hours ago,YouTube,Makan Bergizi Gratis,kalou mbg  pakey uang orang yangkerja di mbg  nganggur
860,20 hours ago,YouTube,Makan Bergizi Gratis,mangpastnya  mengerjakan orang nganggur bisa kerja di  mbg
861,20 hours ago,YouTube,Makan Bergizi Gratis,Setujuuu
862,20 hours ago,YouTube,Makan Bergizi Gratis,pa prabowo jangan direspon  katakan oleh persiden  mbg mengursngi   masarakat nganggur bisa kerja di mbg
863,20 hours ago,YouTube,Makan Bergizi Gratis,Setuju.semua pada mahal😢😢😢
864,20 hours ago,YouTube,Makan Bergizi Gratis,kalou dikasih uang k orangtua pakey setor pnm
865,20 hours ago,YouTube,Makan Bergizi Gratis,pahotman kslou dikasih uang  pasti cuman pake jajan  mangpastnya  mbg kasih makan  mengurangi pengangguran ngartiga pa hotman  mengurangi masarakart nganggur bisakerja di mbg  disekolah pahi2 belummskan anak2 di sekolah waktu istirahat bisa makan  sama22 disekolah  biar ada masarakatyang bisakerja
866,20 hours ago,YouTube,Makan Bergizi Gratis,Siiip pak hotman itu lebih bijak krn makanan yg langsung dr dapur mbg ada yg layak makan
867,20 hours ago,YouTube,Makan Bergizi Gratis,"Yg bener begitu kasih duit, 
tapi kan si gembrot gak terima, karena MBG usaha para garong berkedok partai."
868,20 hours ago,YouTube,Makan Bergizi Gratis,"1000000000 % setuju bang Hotmas, ide cerdas, cemerlang, ...memutus rantai KKN, dan memperkaya diri."
869,20 hours ago,YouTube,Makan Bergizi Gratis,2029 aq yakin akan menang lagiiii. Kalau lgsung kasih uang ke walimurid
870,20 hours ago,YouTube,Makan Bergizi Gratis,UDAH GAK MEMPAN WOWOXXX DAH SOMBONG MERASA PALING BENER MULIA. JADI GAK BUTUH NASEHAT DAN PENDAPAT RAKYAT.
871,20 hours ago,YouTube,Makan Bergizi Gratis,Mantap kali BG...saya sangat setuju
872,20 hours ago,YouTube,Makan Bergizi Gratis,Iya janan di sekolah rame lagi
873,20 hours ago,YouTube,Makan Bergizi Gratis,bang hotman sedang taruhan nii yee
874,20 hours ago,YouTube,Makan Bergizi Gratis,Mantap pak Hotman Paris 👍👍👍👍👍👍👍👍
875,20 hours ago,YouTube,Makan Bergizi Gratis,itu yg tepat pak
876,20 hours ago,YouTube,Makan Bergizi Gratis,"Setuju Bang. Sesuai pemikiran sja, jd yg berisiko dan masuk kriteria kurang mampu adl penerimanya."
877,20 hours ago,YouTube,Makan Bergizi Gratis,Setuju pak Hotman.  Cuma waspada noh tuyul tuyul MBG sdg memantau . Sdg cari cela buat nyolong anggaran😅
878,20 hours ago,YouTube,Makan Bergizi Gratis,SETUJU dengan USUL  HOTMAN . . 👍👍
879,20 hours ago,YouTube,Makan Bergizi Gratis,Mantafff tul tul
880,21 hours ago,YouTube,Makan Bergizi Gratis,Ntar buat beli rokok bapaknya?????
881,21 hours ago,YouTube,Makan Bergizi Gratis,"mantap pak Hotman Paris lebih jelas lagi,kami dukung rakyat pak.."
882,21 hours ago,YouTube,Makan Bergizi Gratis,BILA DI GANTI UANG TIDAK BISA DI KORUPSI BANG HOTMAN......JANGAN MIMPI......😂😂
883,21 hours ago,YouTube,Makan Bergizi Gratis,Kalau beliau tak punya kepentingan politik untuk pilpres 2029 dia pasti setuju dengan masukan itu
884,21 hours ago,YouTube,Makan Bergizi Gratis,betul pak kalok di lanjutkan maka koropsi semngkin pinter sampe dapur di kampung pun bisa koropsi
885,21 hours ago,YouTube,Makan Bergizi Gratis,"Ya Alloh... Lindungilah kami bangsa Indonesia, lindungilah para pemimpin bangsa Indonesia dan seluruh rakyat Indonesia.

MBG sangat bagus dan sangat bermanfaat untuk masyarakat kecil"
886,21 hours ago,YouTube,Makan Bergizi Gratis,Langsung Gassssssss pak Hotman
887,20 hours ago,YouTube,Makan Bergizi Gratis,Saat baca dari sikap prilaku nya.
888,21 hours ago,YouTube,Makan Bergizi Gratis,"Lihat dulu bansos yg nyampek ke masyarakat berapa rupiah,pihak bansos banyak yg korup"
889,21 hours ago,YouTube,Makan Bergizi Gratis,"orang konoha memang kurang gizi tapi b ukan berati kurang makan atau ngga makan yg ada uang kami dimakan pajak,,sama jg mbg uang kami di makan elit politik,,saya setuju kali ini dengan mr.hotman"
890,21 hours ago,YouTube,Makan Bergizi Gratis,klo uang cash se tidaknya ga di korup sama pejabat 😀
891,21 hours ago,YouTube,Makan Bergizi Gratis,Setuju diganti dengan uang
892,21 hours ago,YouTube,Makan Bergizi Gratis,"MAU LAPOR KE POLISI, POLISI PUNYA DAPUR, MAU LAPOR KE TNI, TNI PUNYA DAPUR, MAU LAPOR KE DPR, DPR PUNYA DAPUR, MAU LAPOR KE MUI, ADA YG RANGKAP JABATAN, KLU DI BERIKAN UANG GMNA YG DEMO APA AKAN RIBUT YG PUNYA DAPUR 😂 , MASYARAKAT HARUS MEMBUBARKAN PROGRAM MBG SECARA SERENTAK ITU LAHAN BASAH KORUPSI, BUANG BUANG ANGGARAN"
893,21 hours ago,YouTube,Makan Bergizi Gratis,in baru benar.. biar gk kena korupsi
894,21 hours ago,YouTube,Makan Bergizi Gratis,"diganti uang, yg udah-udah aja gitu cerita nya..?"
895,21 hours ago,YouTube,Makan Bergizi Gratis,Hlaaaa.... Ini 👍👍 .... PIKIRRRRRRRR 😀😀😀😀😀 pemutusan mata rantai untuk para KORUPTOR
896,21 hours ago,YouTube,Makan Bergizi Gratis,Saya sarankan MBG TUTUP TOTAL BAPAK KENAL SAYA KAN😂😂😂
897,21 hours ago,YouTube,Makan Bergizi Gratis,"Mohon Maaf Bang, Saya SANGAT SETUJU 😁"
898,21 hours ago,YouTube,Makan Bergizi Gratis,"setuju bang hot,,,, yg tdk setuju cuma org yg punya Dapur, tapi selain itu semua se777777777777"
899,21 hours ago,YouTube,Makan Bergizi Gratis,"Kalau saya setuju tapi untuk pertumbuhan ekonomi gagal dan untuk menampung tenaga kerja gagal juga
Perekonomian gak jalan"
900,21 hours ago,YouTube,Makan Bergizi Gratis,sangat setuju pak Hotman
901,21 hours ago,YouTube,Makan Bergizi Gratis,"Seluruh rakyat Indonesia pasti se7 kalau bantuan ini berwujud uang,"
902,21 hours ago,YouTube,Makan Bergizi Gratis,"Ini lbh masuk akal,anak jdi lbh smangat sklh.uang pun berputar d daerah itu"
903,21 hours ago,YouTube,Makan Bergizi Gratis,"untuk apa 10 rb per hari mu beli apa, yg bagikan 1m per hari, mending skolah di bikin geratis sampe kulyah itu baru mencerdaskan anak bangsa"
904,21 hours ago,YouTube,Makan Bergizi Gratis,Hidup ahok
905,21 hours ago,YouTube,Makan Bergizi Gratis,Stuju sama dengan pendapat ahok
906,21 hours ago,YouTube,Makan Bergizi Gratis,"Setuju sekali Bang HOT man, MBG di Ganti dgn PGA  Peduli gizi Anak, duitnya Langsung sama org tuanya, Amiin"
907,21 hours ago,YouTube,Makan Bergizi Gratis,"Alhamdulillah,KLO bang Hotman nyapres saya dukung 100%"
908,21 hours ago,YouTube,Makan Bergizi Gratis,klw mllui uang itu bukan MBG hotman...semoga bpk prabowo tdk gubris dgn orang ini....orang ini sdh mulai stresssss....
909,21 hours ago,YouTube,Makan Bergizi Gratis,Setuju bang hotman👍
910,21 hours ago,YouTube,Makan Bergizi Gratis,Hotman paris ini semakin kesini semakin kacau...
911,21 hours ago,YouTube,Makan Bergizi Gratis,Bkn masalah efektif ni masalah gengsi kyk nvak tau aj lu
912,21 hours ago,YouTube,Makan Bergizi Gratis,Hadeeh..
913,21 hours ago,YouTube,Makan Bergizi Gratis,sangat setuju👍👍👍👍👍👍👍👍👍👍👍
914,21 hours ago,YouTube,Makan Bergizi Gratis,"Kalo proyeknya ga korup mana mau , cape2in aja kata mrk 😂"
915,21 hours ago,YouTube,Makan Bergizi Gratis,Setuju bang.hotman
916,21 hours ago,YouTube,Makan Bergizi Gratis,benar bang kajian nya di terima bg sama wowo karena ada kepentingan 2 periode
917,21 hours ago,YouTube,Makan Bergizi Gratis,Paling yg menentang bang hotman yg punya SPPG.
918,21 hours ago (edited),YouTube,Makan Bergizi Gratis,hhhh klo kasikan dlm bntuk uang mana mungkin dia mau?..tar gk dpt labah dong😂
919,21 hours ago,YouTube,Makan Bergizi Gratis,Sangat bagus baru mantap
920,21 hours ago,YouTube,Makan Bergizi Gratis,Nanti yg nampung para pekerja di dapur sppg jadi pengangguran donk bang Hotman 🤠🤭🤠🤭
921,21 hours ago,YouTube,Makan Bergizi Gratis,Benar sekali pak Hotman memang keren mantap❤❤❤❤❤❤❤❤
922,21 hours ago,YouTube,Makan Bergizi Gratis,Benar bang 👍👍
923,22 hours ago,YouTube,Makan Bergizi Gratis,Ini bru pilihan rakyat indonesi..
924,21 hours ago,YouTube,Makan Bergizi Gratis,Semoga MBG menjadi uang
925,22 hours ago,YouTube,Makan Bergizi Gratis,Sangat setuju ❤
926,22 hours ago,YouTube,Makan Bergizi Gratis,Betul itu bang❤❤❤
927,22 hours ago,YouTube,Makan Bergizi Gratis,Beetul harus gitu pak Hotmanparis👍
928,22 hours ago,YouTube,Makan Bergizi Gratis,Klo di ganti uang ntar bwt main judol doang...😂😂😂
929,22 hours ago,YouTube,Makan Bergizi Gratis,Usul mbg diganti program menciptakan lapangan kerja padat karya membersihkan lingkungan sal drainase buntu sal jaringan irigasi tersumbat sampah berserakan rakyat ada pendapatan ada produksi ada daya beli ada peningkatan gisi anak jangan bansos untuk judol beli rokok anak cacingan stanting
930,22 hours ago,YouTube,Makan Bergizi Gratis,Hal seperti ini sudah banyak disuarakan mungkin memang keinginan beliau apapun alasannya MBG harus tetap berjalan
931,22 hours ago,YouTube,Makan Bergizi Gratis,"Betul bang, tapi jangan semua orang tua di kasih bang. Kelas menengah ke bawah saja"
932,22 hours ago,YouTube,Makan Bergizi Gratis,"Setuju dengan bang hotman, seharus nya seperti itu
Langsung ke penerima manfaat yang  menerima dana bantuan"
933,22 hours ago,YouTube,Makan Bergizi Gratis,"Trima kasih bang hotman..
Alhamdulillah bang hotman banyak berbuat kebaikan..sekali lagi .terima kasih bang..sudah berbuat untuk kebaikan NKRI.."
934,22 hours ago (edited),YouTube,Makan Bergizi Gratis,"Mgkn Prabowo skrng udah beda dg yg dulu, Bang
Dulu semasa blm ada ibu negara 
😅"
935,22 hours ago,YouTube,Makan Bergizi Gratis,"Nah itu bagus tapi penyalurannya haris benar benar tepat sasaran jangan melalui dept pendidikan atau pihak sekolah bisa korup lagi nanti 
Saran saya langsung k orang tua melalui bank negara yg bisa d ambil memakai kartu semacam ATM tapi kusus program mbg"
936,22 hours ago,YouTube,Makan Bergizi Gratis,"Gagasan yang Bagus👍👍👍
Lanjutkan rakyat mendukung
Daripada di korupsi golongan atas"
937,22 hours ago,YouTube,Makan Bergizi Gratis,betul pak hotman 15 rb dikasih ke ibu anak gabakal dibeliin daging hiu beracun.
938,22 hours ago,YouTube,Makan Bergizi Gratis,betol bng
939,22 hours ago,YouTube,Makan Bergizi Gratis,Sudah banyak kasih saran tapi semua tak dianggap....
940,22 hours ago,YouTube,Makan Bergizi Gratis,Setijuuuuu bang hotmat biar terhindar koruuuup
941,22 hours ago,YouTube,Makan Bergizi Gratis,"Setuju banget apa yg di bicarakan oleh ahok, KDM dan hotmat saya yakin prabowo 2 priode dan rakya sejahtera"
942,22 hours ago,YouTube,Makan Bergizi Gratis,SETUJUUUUUU 1000%
943,22 hours ago (edited),YouTube,Makan Bergizi Gratis,"Gak setuju kalo MBG digantikan dgn uang.. Karena dengan adanya makanan/Lauk pauk serta susu dan buah.. Dapet menggerakan perekonomian dari petani,nelayan,jutaan orang bisa bekerja karena MBG."
944,22 hours ago,YouTube,Makan Bergizi Gratis,Inimah usulan pak ahok dlu😂
945,22 hours ago,YouTube,Makan Bergizi Gratis,Ini sangat rasional sekali
946,22 hours ago,YouTube,Makan Bergizi Gratis,MGG bisa dirasakan petani
947,22 hours ago,YouTube,Makan Bergizi Gratis,Setuju bang
948,22 hours ago,YouTube,Makan Bergizi Gratis,Sepakat pak hotman
949,22 hours ago,YouTube,Makan Bergizi Gratis,Setujuuuu
950,22 hours ago,YouTube,Makan Bergizi Gratis,Setuju❤❤❤👍👍👍
951,22 hours ago (edited),YouTube,Makan Bergizi Gratis,"Ini usulan keren,tapi sayangnya MBG sudah jadi ladangnya para koruptor"
952,22 hours ago,YouTube,Makan Bergizi Gratis,Pokoknya Bang HOTMAN PARIS SEORANG SATRIYA..maju kedepan dibanding PEngacara lainnya
953,22 hours ago,YouTube,Makan Bergizi Gratis,S.7..sekali..
954,22 hours ago (edited),YouTube,Makan Bergizi Gratis,"Nggak bakalan mau nanti korupsinya sedikit dong 
Si kakek-kakek pikun itu kalau dikasih masukan nasihat jawabannya cuma Nye Nye Nye Nye atau ndasmu emang gue pikirin"
955,22 hours ago,YouTube,Makan Bergizi Gratis,Yg ga Setuju pasti org2 yg loyal Prabowo bang
956,23 hours ago,YouTube,Makan Bergizi Gratis,"Gak semudah itu bang.., gimana dgn orang² yg sudah terlanjur investasi bangun dapur??, gimana dgn orang² yg terlanjur menggantungkan hidup kerja di sppg???"
957,23 hours ago,YouTube,Makan Bergizi Gratis,"Pengacara gak usa ngurusin mbg bang2, Podo wae  ibunya di kasih uang malah gak ngurus anak ,sibuk main hp ,lah ada uang buat beli kota."
958,23 hours ago,YouTube,Makan Bergizi Gratis,"Kalau MBG implementasi nya sesuai ucapan bung hotman

Saya setuju MBG ada

Tapi kalau bentuk SPPG 
BUBARKAN MBG"
959,23 hours ago,YouTube,Makan Bergizi Gratis,Ini baru betull..pasti berputar uang nya dtempat yg pas!!
960,23 hours ago,YouTube,Makan Bergizi Gratis,Sudah di sarankan ahok dari dulu tapi bang nanti temenku gk kebagian dong😅😅😅😅😅
961,23 hours ago,YouTube,Makan Bergizi Gratis,Yang sudah bikin dapur bisa nagis😢😢😢😢guling guling😅😅😅😅😅😅
962,23 hours ago,YouTube,Makan Bergizi Gratis,"Ini baru ide bener, bantuan langsung dikasihkan orang tuanya murid, tapi... Itupun masih di pungli oknum2 pegawai, harus dikawal hukum yang ketat"
963,23 hours ago,YouTube,Makan Bergizi Gratis,"si bowo tau bang hotman klo itu lbh efektif,yg jd masalah duitnya gak bs di korupsi dong"
964,23 hours ago,YouTube,Makan Bergizi Gratis,"Ekonomi pasti jalan, karna pergerakan uang merata.."
965,23 hours ago,YouTube,Makan Bergizi Gratis,mntap bg
966,23 hours ago,YouTube,Makan Bergizi Gratis,YezzzZz
967,23 hours ago,YouTube,Makan Bergizi Gratis,SATU LAGI OMONG KOSONG DARI  manusia sakit
968,23 hours ago,YouTube,Makan Bergizi Gratis,GK komennnn
969,23 hours ago,YouTube,Makan Bergizi Gratis,Setuju uang tunai di berikan .terima kasi lae.tidak bisa lagi korupsi
970,23 hours ago,YouTube,Makan Bergizi Gratis,ini juga usulan ahok dari dulu
971,23 hours ago,YouTube,Makan Bergizi Gratis,Setuju bang hotman
972,23 hours ago,YouTube,Makan Bergizi Gratis,👍👍 org tua nya bisa beli kebutuhan pokok seperti beras
973,23 hours ago,YouTube,Makan Bergizi Gratis,"Makanan aja pak,biar berputar uangnya"
974,23 hours ago,YouTube,Makan Bergizi Gratis,"KLO diganti uang,malah gak jadi buat beli makanan bergizi malah buat beli pulsa sama bayar utang😂"
975,23 hours ago,YouTube,Makan Bergizi Gratis,"Kalau beri dana tunai ke ortunya anak maka sangat hemat uang negara, tapi bagaimana para loyalis bisa dapat dana?"
976,23 hours ago,YouTube,Makan Bergizi Gratis,Sy rasa lucu aja
977,23 hours ago,YouTube,Makan Bergizi Gratis,Itu orang tuanya yg pake untuk judol hotman paris. Jgan ko usik lgi
978,23 hours ago,YouTube,Makan Bergizi Gratis,"Hotman paris itu uang malah orang tua anak"" yg pake untuk keperluhannya."
979,23 hours ago,YouTube,Makan Bergizi Gratis,Mantap banggg...
980,23 hours ago,YouTube,Makan Bergizi Gratis,"Ahok sudah ngomong duluan begitu Pak Hotman,Mauliate"
981,23 hours ago,YouTube,Makan Bergizi Gratis,Mantap ini pak .. 10juta x saya setuju pak
982,23 hours ago,YouTube,Makan Bergizi Gratis,Makanan cepat basi
983,23 hours ago,YouTube,Makan Bergizi Gratis,Ya biar para koruptor g bisa nipu
984,23 hours ago,YouTube,Makan Bergizi Gratis,Betul.bang hotman
985,23 hours ago,YouTube,Makan Bergizi Gratis,"Dulu mafpud md mau dikte hakim,jaksa,negara, sekarang Hotman, mengungkit jasanya agar negara bisa di atur hotman"
986,23 hours ago,YouTube,Makan Bergizi Gratis,Uang dikasih ortunya nanti dibelikan rokok 😅
987,23 hours ago,YouTube,Makan Bergizi Gratis,"Kalau MBG di ganti dengan uang , akan di salah gnakan orang tua nya ke yang lain , percayalah pak gak jadi ke anak"
988,23 hours ago,YouTube,Makan Bergizi Gratis,Kurang pas juga pak bos..BLT hilang saya dibatam sangat memerlukan. Sudah tua gini hidup sebatang kara susah cari makan.hanya mengharap hasil ternak entok dari BLT pertama pak jokowi
989,23 hours ago,YouTube,Makan Bergizi Gratis,Respek bang hotman
990,23 hours ago,YouTube,Makan Bergizi Gratis,Setuju banget bang semilyar kali saya setuju banget
991,23 hours ago,YouTube,Makan Bergizi Gratis,"Kalau MBG di ganti dalam bentuk uang akan di gunakan orang tuanya untuk judol dan lain sebagai nya , jadi pak prabowo tetap aja pada pendirian nya karna jutaan anak sudah menikmati nya"
992,23 hours ago,YouTube,Makan Bergizi Gratis,Kalau MBG uangnya langsung diberikan ke orang tua 90% para pejabatnya tidak bisa maling uang MBG (uang rakyat)
993,23 hours ago,YouTube,Makan Bergizi Gratis,"Mbg benar2 sarang korupsi, tidak hanya diatas saja,dibawah sama saja, banyak distributor bilang, telur harga 2000 dinota suruh tulis 4000, ayam harga 3000 disuruh tulis 5000 dan lain2 itu modusnya"
994,23 hours ago,YouTube,Makan Bergizi Gratis,"Bagus sekali kali dikasihkan uang. Cz Lo nasi gak dimakan sama anak"". Mubadhir sebab setiap hari Lo dpt MBG gak dimakan, saya Kasikan ayam MBG nya."
995,23 hours ago,YouTube,Makan Bergizi Gratis,SETUJUUUUU!!!!
996,23 hours ago,YouTube,Makan Bergizi Gratis,ALHAMDULILLAH ALLAH MENGIRIM HOTMAN PARIS.BANGSABDAN NEGARA' SELAMAT DARI JEBAKAN
997,1 day ago,YouTube,Makan Bergizi Gratis,"BRAVO BUNG HOTMEN CERDAS 1000 % SETUJU MBG DI BERIKAN UANG TUNAI LANGSUNG KPD YG BERHAK JGN LEWAT MANA MANA KARNA NANTI PASTI  DI COPET LG OLEH PARA PEJABAT BAPAK ...
PENGALAMAN  MBG DADAN SERANGGA CS DI RANPOK KAN BPK GA MALU ??..."
998,1 day ago,YouTube,Makan Bergizi Gratis,"Mbg sudah terbaik gak usah usulan lagi. Sudah terbaik dari segi manapun, lapangan kerja terbentuk, ekonomi desa berputar. Yg punya kuasa dibidangnya awasi jgn sampai di korupsi"
999,1 day ago,YouTube,Makan Bergizi Gratis,S7
1000,1 day ago,YouTube,Makan Bergizi Gratis,Setuju banget usulan abang the best
1001,1 day ago,YouTube,Makan Bergizi Gratis,Mendukung
1002,23 hours ago,YouTube,Makan Bergizi Gratis,"Pemikiran yg lucu, dri pda di korupsi di ksih mkanan gk gak sesuai. pasti ini karyawan MBG."
1003,1 day ago,YouTube,Makan Bergizi Gratis,Cukup ortunya kasih kerjaan yg layak dah
1004,1 day ago,YouTube,Makan Bergizi Gratis,"Yg TDK setuju,it cuman tukang dapur mbg,krna TDK bsa kuropsi.
Lanjutkan PK Hotman,sampai brhsil"
1005,1 day ago,YouTube,Makan Bergizi Gratis,"Lebih pas begitu.mbg ini juga bagus,tapi banyak koruptor di dalam nya.kasih aja langsung uang nya ke keluarga yg kurang mampu."
1006,1 day ago,YouTube,Makan Bergizi Gratis,Setuju bang hotman is the beast❤
1007,1 day ago,YouTube,Makan Bergizi Gratis,WKWK YAYASAN DAN PEGAWAI SPPG KETAR KETIR 😂😂😂😂😂
1008,1 day ago,YouTube,Makan Bergizi Gratis,"99,9% rakyat Indonesia sanggar setuju PK Hotman..
Tolong PK Hotman Paris,cuman BPK yg bisa menyampaikan isi hati dan kehendak 99,9% msyrkt Indonesia in,supaya dana mbg TDK di kuropsikan...
Bnyk ke untungan jika mbg di ksh uangnya ke orang tua murid...
Dananya bisa di alihkan ke ongkos sekolah dan kebutuhan anak sekolah.
Jika mbg di bagikan uangnya,bisa membuat hrga ayam,telor,daging,dan sayuran buah2an bisa Mura msyrkt terbantu"
1009,1 day ago,YouTube,Makan Bergizi Gratis,Tinggal angkat pengawas makanan di sekolah... Kalau orang tua tidak bikinkan makanan uang tinggal di setop...
1010,1 day ago,YouTube,Makan Bergizi Gratis,Tidak efektif untuk pencuri
1011,1 day ago,YouTube,Makan Bergizi Gratis,Ah .tuk beli rokok sama judi om
1012,1 day ago,YouTube,Makan Bergizi Gratis,"Bagus sih pak, bisa orangtuanya bantu cicil utang mekarnya, atau utang yang lain, petani jadi korban juga pak, terus pegawai yang lain."
1013,1 day ago,YouTube,Makan Bergizi Gratis,Betul bang itu yg bijak.kalau diganti dg uang.
1014,1 day ago,YouTube,Makan Bergizi Gratis,bnr bgt....psti gk bs di korupsi....
1015,1 day ago,YouTube,Makan Bergizi Gratis,"Setuju bang, ini sangat efektif memutus rantai korupsi di MBG"
1016,1 day ago,YouTube,Makan Bergizi Gratis,"Betul dukung pengacara top
Di ganti uang itu pikiran orang sehat,"
1017,1 day ago,YouTube,Makan Bergizi Gratis,Anak.sekola.bisa.ambil.uang.di.kopdes.mera.putih.
1018,1 day ago,YouTube,Makan Bergizi Gratis,Setuju....!!!
1019,1 day ago,YouTube,Makan Bergizi Gratis,Se7 biar gak ada koropsi
1020,1 day ago (edited),YouTube,Makan Bergizi Gratis,"Bantuan bentuk uang cash itu kurang tepat, cara yang paling bagus menggunakan kupon setiap siswa, siswa menggunakan kupon tersebut untuk di pakai dan diserah ke kepenjual makan, penjual makanan pasti akan berlomba  meningkatkan mutu makannya. Sesuai harga kuponnya. Siswa dapat memilih makanan sesuai kesukaan nya. Kalau Dapur MBG itu mematikan usaha katin sekolah."
1021,1 day ago,YouTube,Makan Bergizi Gratis,Setuju .mantap itu bang
1022,1 day ago,YouTube,Makan Bergizi Gratis,Mestiilah
1023,23 hours ago,YouTube,Makan Bergizi Gratis,"Betul, selain itu. Hanya orang tua kandung yang benar2 peduli terhadap gizi anaknya. Kalau orang lain yang masak, karena memikirkan harus ada margin sering kali makanan kurang diperhatikan lebih mengutamakan penyedap rasa."
1024,21 hours ago,YouTube,Makan Bergizi Gratis, @WendryMarbun data darimana itu
1025,16 hours ago,YouTube,Makan Bergizi Gratis,​ @WendryMarbun  UANG TUNAI BUAT MAIN JUDOL ASEK! 😂 PERBAIKAN EKONOMI BANDAR JUDOL
1026,19 hours ago,YouTube,Makan Bergizi Gratis,"Byk ortu gak bener juga malah dibelikan rokok. Byk orang susah keluarga makan cuma pake tepung2 ngan, tp Bapaknya rokok kopi jalan teros"
1027,19 hours ago,YouTube,Makan Bergizi Gratis,​ @loststreamnxt kamu itu mencerminkan komentar mu. Ada bukan berarti semua. Banyak? Banyak darimana? Kamu denger berita? Dari 1 juta orang kemungkinan seperti yang kamu bayangkan itu 100 orang.
1028,16 hours ago,YouTube,Makan Bergizi Gratis,UANG TUNAI BUAT MAIN JUDOL ASEK! 😂
1029,14 hours ago,YouTube,Makan Bergizi Gratis,​ @sigitasgood2325 benar sekali itu kalo melalui dapur sppg kan bisa di evaluasi kalo tidak sesuai makanan nya coba kalo berbetuk uang gimana caranya mengevaluasi nya???
1030,46 minutes ago,YouTube,Makan Bergizi Gratis,​ @sigitasgood2325 iya mungkin itu anda😂
1031,14 hours ago,YouTube,Makan Bergizi Gratis,"Maff kalo berbentuk uang belum tentu jadi makan bergizi sedangkan masarakat kebanyakan orang mempunyai utang, 😅"
1032,54 minutes ago (edited),YouTube,Makan Bergizi Gratis,"SETUJU..!
Masih banyak ORTU penerima bantuan MBG yang WARAS untuk kepentingan anak² nya."
1033,1 day ago,YouTube,Makan Bergizi Gratis,setuju saya.
1034,1 day ago,YouTube,Makan Bergizi Gratis,"Sgt
Setuju"
1035,1 day ago,YouTube,Makan Bergizi Gratis,Bagus jg ide luh
1036,1 day ago,YouTube,Makan Bergizi Gratis,Mau dlm bentuk uang..ada kemungkinan jg dikorup..atau mingkin..tdk tepat sasaran..siapa penerimanya.
1037,1 day ago,YouTube,Makan Bergizi Gratis,"Betul, daripada sarang korop"
1038,1 day ago,YouTube,Makan Bergizi Gratis,"Nanti dijawab pak Prabowo sambil mandi, bilang yee..yee..yee, emang gue pikirin?..berabe deh.."
1039,1 day ago,YouTube,Makan Bergizi Gratis,Kalau Bung Hotman yang bicara belum tentu didengarin...coba deh sekab nya... pasti didengarin 😂😂😂
1040,1 day ago,YouTube,Makan Bergizi Gratis,SETUJU PAK HOTMAN
1041,1 day ago,YouTube,Makan Bergizi Gratis,"Walaupun anak saya penerima mbg saya setuju mbg dialihkan.atau tetep ada mbg tapi TDK disamaratakan ke semua wilayah dipilah2 wilayah mana yg perlu mbg dan mana yg lebih TDK perlu mbg.di kota2 umumnya TDK perlu mbg ,mungkin di pelosok diperlukan mbg gak masalah."
1042,1 day ago,YouTube,Makan Bergizi Gratis,"Bagus juga lgsg dikasih ke org tuanya.. asal Org tua nya juga harus amanah.... Jgn dipergunakan buat yg lain.. buat belanja online, buat skincare,,, jadi tujuan memberikan makan bergizi kepada anak dapat tersalurkan dg baik 🙏"
