id,tanggal,platform,topik,teks
1,19 seconds ago,YouTube,Makan Bergizi Gratis,Satu satunya jalan MBG harus di tutup
2,34 seconds ago,YouTube,Makan Bergizi Gratis,"SPPG Fiktif bukan hanya di pulau jawa saja.... hampir di seluruh provinsi ada SPPG Fiktif....
Bukan sengkarut tapi otak maling nya yg luar biasa."
3,1 minute ago,YouTube,Makan Bergizi Gratis,"Pak Presiden tangani baik dong, SPPG FIKTIF ini. Cari koruptornya..
Muak lihat org2 rakussss😫"
4,4 minutes ago,YouTube,Makan Bergizi Gratis,Setengah periode
5,5 minutes ago,YouTube,Makan Bergizi Gratis,Cukup satu periode
6,6 minutes ago,YouTube,Makan Bergizi Gratis,Fix ..2029 gw gak pilih lagi Prabowo..
7,11 minutes ago,YouTube,Makan Bergizi Gratis,Heran juga nengok presiden niii ....kok gk jdi pelajaran...dh byk buat kesalahan....
8,11 minutes ago,YouTube,Makan Bergizi Gratis,"Assalamualaikum wr wb. Good Job Pak Prabowo, Pak Burhanudin, dan Pak Purbaya 👍👍👍 Demi rakyat RI 👍👍👍 Tetap diteruskan saja NIAT MULIANYA Pak Prabowo, MBG nya Demi Rakyat RI 👍👍👍"
9,11 minutes ago,YouTube,Makan Bergizi Gratis,Sayurnya di perbaiki jgn asal buat sayur
10,12 minutes ago,YouTube,Makan Bergizi Gratis,"Benar kata P Mahfud, "" Hukum mati saja"" !"
11,13 minutes ago,YouTube,Makan Bergizi Gratis,Yg takut kelaparan pejabatnya bukan rakyatnya
12,14 minutes ago,YouTube,Makan Bergizi Gratis,"Halo negara konoha...gimana kbr nya hari ini,apa baik baik ajak ..jdi bual bualan negara tetangga hhhh"
13,15 minutes ago,YouTube,Makan Bergizi Gratis,"Ganti MBG jadi MBK, Makan Bergizi Koruptor"
14,19 minutes ago,YouTube,Makan Bergizi Gratis,Paling nye nye nye nye
15,33 minutes ago,YouTube,Makan Bergizi Gratis,Yang punya dapur MBG fiktif mungkin siluman
16,33 minutes ago,YouTube,Makan Bergizi Gratis,"mau banyak sppg fiktif jg gpp yg penting korupsi jalan terus  itu tujuan berdirinya MBG agar apbn bisa dikeurk habis""an tambah lagi hutang luar negerinya dong sebanyak"" nya bila perlu negara ini dijual saja demi kemakmuran dan kesejahteraan koruptor😂😂😂"
17,34 minutes ago,YouTube,Makan Bergizi Gratis,"Pemilik dapur niat awal nya bukan sosial
Tapi CUAN😢😢😢"
18,45 minutes ago,YouTube,Makan Bergizi Gratis,"Mending langsung di kasih 15rb perhari biar mamak mamaknya sendiri yg mikirin gizi anak anak mereka,pasti ekonomi bisa berputar"
19,46 minutes ago,YouTube,Makan Bergizi Gratis,Tidak mungkin cuma 100 kalau mereka bisa gerakkan pendemo pro mbg di seluruh provinsi
20,1 hour ago,YouTube,Makan Bergizi Gratis,"MBG berpuharus di jalankan, kalau ada kebocoran ya harus di benahi dan dijaga dan diperbaiki tapi bukan sampai stop karena ini, bukan soal mbg nya tapi demi generasi msa depan anak kita 20 taun yang akan datang, jadi supaya kita bisa bersaing dan sdm anak kita bisa bersaing seperti negara lain yang maju seperti japan yang ada mbg karena setiap protein dan gizi penting untuk masa depan anak kita kedepan, dan dari ekonomi ini langsung digucur ke desa agar manfaat nya bisa berantai dan seperti lapangan pekerjaan dan warung sembako hidup, petani dan nelayan, serta yang baru adalah petani ternak susu sapi bisa hidup agar bisa TKDN dalam negeri 100℅ demi mengerakan ekonomi dari bawah agar bisa hidup dan berputar"
21,1 hour ago,YouTube,Makan Bergizi Gratis,"RAKYAT LAPAR KARENA KEKAYAAN NEGARA, SDA NYA DIRAMPOK PENGUASA, PEJABAT, PARLEMEN, APARAT, PENEGAK HUKUM, OLIGARKI YANG SALING BERKOLABORASI DEMI KEKAYAAN ANAK CUCU 7 KETURUNAN KARENA MASIH KELAPARAN DENGAN HARTA.
RAKYAT LAPAR KARENA EKONOMI MASYARAKAT MATI AKIBAT DAYA BELI RENDAH, BEBAN HIDUP TINGGI DAN TIDAK ADA LAPANGAN KERJA.
RAKYAT LAPAR KARENA KEBIJAKAN2 YANG DIBUAT HANYA UNTUK MENGKAYAKAN SEGELINTIR ORANG TAPI MEMISKINKAN RATUSAN JUTA ORANG.
ZAMAN PAK HARTO TIDAK ADA MBG TAPI TIDAK ADA PROGRAM YANG MERAMPOK KEKAYAAN NEGARA SEHABIS2NYA ATAS NAMA PROGRAM MENGENYANGKAN RAKYAT DAN GIZI. PADAHAL HARI INI YANG KELAPARAN DAN KURANG GIZI KALANGAN ATAS YANG SEMAKIN HARI SEMAKIN SERAKAH DAN TIDAK TAKUT DENGAN HUKUMAN ALLAH. BANYAK INDUSTRI2 HILIR YANG BISA DIBANGUN DI SETIAP DAERAH DENGAN BAHAN BAKU HASIL PERTANIAN, PERKEBUNAN, TAMBANG DSB UNTUK MEMBUKA LAPANGAN KERJA BAGI ORANGTUA2 DAN GENERASI MUDA DARI SABANG SAMPAI MERAUKE AGAR RAKYAT DAPAT MEMBERI MAKAN DAN GIZI BAGI KELUARGANYA  NEGARA INI DIBANGUN BUKAN UNTUK BUAT DAPUR UMUM. JUSTRU PARA PEDAGANG DAN MASYARAKAT  MENGELUH KARENA SEMBAKO NAIK SEJAK ADA MBG. MBG MERAMPOK KEKAYAAN NEGARA DAN JUGA DAYA BELI MASYARAKAT"
22,2 hours ago (edited),YouTube,Makan Bergizi Gratis,"PEMERINTAHAN PRABOWO-GIBRAN ADALAH PEMERINTAHAN BTL ( BUTA, TULI & LUMPUH OTAKNYA ).
SAKIT JIWA & BERKELAINAN MENTAL, MANA MUNGKIN BISA BENAR NGURUS NEGARA   BAHAYA JIKA TERUS DILANJUTKAN. BAKAL HANCUR & BERANTAKAN BANGSA & NEGARA INI.
Ribuan SPPG fiktif  tersebar diseluruh indonesia."
23,2 hours ago,YouTube,Makan Bergizi Gratis,KLO niat MBG yg srius anti korupsi alangkah baiknya dana di transfer aja ke rekening orang tua masing2 lebih mudah di data dan akurat karna sesuai data murid di sekolah
24,2 hours ago,YouTube,Makan Bergizi Gratis,Kalau pun program MBG ingin di jalankan maka agar TDK terjadi jebolnya APBN bubarkan lembaga BGN beserta personal yg ada ddlmnya lalu alihkan ke lembaga BPOM
25,2 hours ago,YouTube,Makan Bergizi Gratis,"Jubir PEMERINTAH kalau lawan mas MEDIA pada takut semua,karna mas MEDIA data nya VALID 😂"
26,2 hours ago,YouTube,Makan Bergizi Gratis,Percuma mau bilang ky apa jg nanti endingnya 2029 yg di pilih orang orang ky gitu jg tetep aja orang Golkar yg pd jd Pejabat Pemerintahan nya😮
27,2 hours ago,YouTube,Makan Bergizi Gratis,hitung sendiri lah itu baru 1 kabupaten...kalo 1 sppg insentip 6 jt/hr...kalo 100 sppg=600 jt... sdh berlangsung brp lama...????? ini kejahatan luar biasa... semua yg terlibat minimal dihukum 20 thn dan pelaku utama nya dihukum mati ataau seumur hidup tanpa remisi di Nusakambangan.
28,2 hours ago,YouTube,Makan Bergizi Gratis,Memang bedebah.yg atas dan bawah korup.ada sekolah murid cuman 30 dpt jatah MBG 90.ADA juga jatah MBG/ kepala di ambil 1000 rupiah utk jatah guru per 1 bulan di cairkan jadi uang dan di bagi rata.semua penipu
29,2 hours ago,YouTube,Makan Bergizi Gratis,PRESIDEN KEPALA BATUUUUU
30,2 hours ago,YouTube,Makan Bergizi Gratis,Murah itu. Podo mau lah 350 juta murah apalagi udahnlegngkap plus produk di beli cash ..tapinklo bayar 1 Minggu Ndak lah bejol. ..modal apalgi PNS ada biaya2 siluman .contoh splier  harus setor 100 per kg  ke pemberi order pegawaiterkait ..
31,2 hours ago,YouTube,Makan Bergizi Gratis,100 x 6 juta. Sehari 🤑🤑🤑🤑🤑🤑🤑🤑🤑🤑🤑🤑🤑🤑🤑🤑🤑 prabowo presiden idaman.
32,2 hours ago,YouTube,Makan Bergizi Gratis,"Ga mau melibatkan kantin & umkm sekolah aja saya udah curiga.. 
Membuka yayasan adalah konflik kepentingan untuk mempermudah merampok uang rakyat.. 
😂"
33,2 hours ago,YouTube,Makan Bergizi Gratis,Bubarkan tak perlu evaluasi tutup saja MBG program penipu sarang koruptor JD tutup selamanya program yg hy menghabiskan pajak rakyat kok BS sppg yg fiktif ya MBG SDH menipu pemerintah d rakyat bubarkan akan selesai  permasalahan di negara kita ini tak perlu tata kelola lagi yg jelas sarang koruptor  koruptor ya ttp koruptor bubarkan hy memiskan rakyat di otak nya para pejabat SDH jahat bubarkan semuanya itu SDH disengajakan orak koruptor dibubarkan
34,2 hours ago,YouTube,Makan Bergizi Gratis,Masukan celios ttg MBG jk ditindak lanjuti.maka masyarakat yg memang sangat perlu dibantu MBG itu saja yg terbantu
35,2 hours ago,YouTube,Makan Bergizi Gratis,Yaa Alloh uang rakyat di hambur2 kan sama pemerintah rusak banget
36,2 hours ago,YouTube,Makan Bergizi Gratis,"MEREKA PADA KEMANA SIH? LUAR BIASA NYA BARU TAU SEKARANG? AH SUDAHLAH, IKAN BUSUK DARI KEPALA"
37,2 hours ago,YouTube,Makan Bergizi Gratis,"Lanjutkan MBG kami petani menik mati pedapatan dari mbg,dan basmi oknum yg nakal,"
38,3 hours ago,YouTube,Makan Bergizi Gratis,"Mestinya pa presiden ..sebagai seorang jendral TNI ..memiliki nyali , keberanian  untuk mengakui kegagalannya mengelola APBN .dan perbaiki kesalahannitu.
Orang yg di cintai dan dianggap jujur , berani ..adalah orang yg dgn gagah berani mengaku kesalahan nya 
Tanpa itu jangan harap  presiden  dapat memperbaiki kerusakan ini.
Jendral ?  ..hmmmm...jendral bermental satpam !"
39,3 hours ago,YouTube,Makan Bergizi Gratis,"MBG harus di bubar kan . Salah satu penyebab mahalnya bahan pokok dan sayuran karena ada nya MBG,,,,,

Heran juga negara ini. Duit dari hasil hutang tapi di gunakan tdk tepat sasaran .. MBG dan koperasi merah putih,,,,,ini adalah ladang korupsi terbesar di sedunia.."
40,3 hours ago,YouTube,Makan Bergizi Gratis,Astaghfirullah 🤮🤮🤮 tidak mbg sppg🚫🚫🚫🚫🚫
41,3 hours ago,YouTube,Makan Bergizi Gratis,"Inflasi semakin mencekik, negara tetap hamburkan uang, koplak 😅"
42,3 hours ago,YouTube,Makan Bergizi Gratis,"Udh dibilang jangan pilih pemimpin joget2, gemoy2 alhasil hancur lebur"
43,3 hours ago,YouTube,Makan Bergizi Gratis,Pocong pun makan mbg😂😂
44,3 hours ago,YouTube,Makan Bergizi Gratis,"Yg benar dapurnya di setiap sekolah setempat ada berapa siswa di sekolah2 itu ada berapa juru masaknya dan libatkan pihak pukesmas masalah gizinya ,tidak usah memakai alat angkut yg memakan uang banyak."
45,3 hours ago,YouTube,Makan Bergizi Gratis,Dari awal sudah ada potensi korupsi tp pemerintah tuli  gak mau mendengar keluhan rakyat
46,3 hours ago,YouTube,Makan Bergizi Gratis,"INI BARU 1 KABUPATEN , JAN KOPLAK, JABANG BAYI , DOH DOH SING ADOH."
47,3 hours ago,YouTube,Makan Bergizi Gratis,"Usuutt tuntass sampe keakar2nyaa..yg buat kebijakann jgn sampee loloss,sangat2 dzolimm kebodohannya,mbg,kdmp,dan program2 laen yg mengurass uang rakyatt"
48,3 hours ago,YouTube,Makan Bergizi Gratis,Semakin besar anggaran semakin besar kemungkinan dikorupsi.... 😢😢😢😢
49,3 hours ago,YouTube,Makan Bergizi Gratis,MBG   manufer  penghianat Prabowo  sengaja dikacaukan agar Prabowo jelek
50,3 hours ago,YouTube,Makan Bergizi Gratis,pastilah didemo (pengusaha2 dapur SPPG+karyawan2nya) itu MBG untuk terus dilanjutkan..😂😂😂
51,3 hours ago,YouTube,Makan Bergizi Gratis,Mbg dan kdmp sangat rawan korupsi dan kebocoran anggaran dalam jumlah JUMBO.
52,3 hours ago,YouTube,Makan Bergizi Gratis,Bayangkan...di Cilacap aja ada 100 SPPG Fiktif...belum di daerah=daerah terpencil lain di indonesia...wajar jika Dadan bisa setor 2 T ke mantan yang amat sangat culas dan rakus
53,3 hours ago (edited),YouTube,Makan Bergizi Gratis,"Apa dia pikir dengan asal perintah, program akan langsung jalan mulus ya? Tiba2 aja gt dadakan ? Konyol banget....terus disangkanya dengan perintah saja, dibangunkan saja gedungnya koperasi bakal jalan ???? Hadeuhhhh dangkal banget otaknya."
54,3 hours ago,YouTube,Makan Bergizi Gratis,dari 10+6 aja udah bisa disimpulkan
55,3 hours ago,YouTube,Makan Bergizi Gratis,Program yg Joss 😂😂
56,4 hours ago,YouTube,Makan Bergizi Gratis,Setuju makanan kurang higenis karna di kejar waktu bukan seteril malah penyakit yang ada
57,4 hours ago,YouTube,Makan Bergizi Gratis,Tdak ada kata lain MBG HENTIKAN TOTAL!!!!! Kalu Prabowo ngotot.... Ceos yg ada
58,4 hours ago,YouTube,Makan Bergizi Gratis,"5:30 sya kira dulu begitu dikelola masing2 komunitas sekolah.
Ada yg bilang rawan penyalahgunaan anggaran, sentralisasi juga bocor kan😅
Biar sekolah masing2 yg urus"
59,4 hours ago,YouTube,Makan Bergizi Gratis,makin parah korupsinya demi termul termul ...
60,4 hours ago,YouTube,Makan Bergizi Gratis,"Sppg fiktif sama juga kdmp pasti ada fiktif,Krn pemerintah pusat hanya lihat titik tpi TDK cek wujudnya,asal bayar sj😂😂"
61,3 hours ago,YouTube,Makan Bergizi Gratis,Makanan index 6 rb yg sampai ke anak2 itu Bos
62,4 hours ago,YouTube,Makan Bergizi Gratis,"mas klo di kasihkan berupa makanan matengan / siap santap, masa aja. Pasti ada di koropsi yg bersangkutzn / pengelola. Klo setuju stop saj MBG seterus nya."
63,4 hours ago,YouTube,Makan Bergizi Gratis,"UDH DIBILANG MAHASIWA HENTIKAN DULU MBG ROMBAK SEMUA YA MENGHINDARI HAL KAYA GINI DAPUR FIKTIF SELAMA SETAHUN
HANCUR APBN BERUJUNG RAKYAT GAMAU BAYAR PAJAK"
64,4 hours ago,YouTube,Makan Bergizi Gratis,Disengaja untuk mendulang biaya politik
65,4 hours ago,YouTube,Makan Bergizi Gratis,"udah saatnya Indonesia mengurangi jumlah parpol.. makin banyak parpol,. makin gila-gilaan korupsi"
66,4 hours ago,YouTube,Makan Bergizi Gratis,Tutup
67,4 hours ago,YouTube,Makan Bergizi Gratis,mbg tambah ruwer guru murid bubar kan aja di ganti uang aja pada anak skolah yg tidak mampu lebih efektif  biaya murah kok banyaken cingcong bubar kan beres
68,4 hours ago,YouTube,Makan Bergizi Gratis,PROGRAM YG MERUGIKAN KEUANGAN NEGARA DAN TIDAK BERMANFAAT BAGI RAKYAT INDONESIA..  MBG DAN KOPDES MERAH PUTIH WAJIB SEGERA DI HENTIKAN . PADAHAL SUDAH DI DEMO OLEH MAHASISWA TAPI PRABOWO TETAP MAKSA MELANJUTKAN PROGRAM MBG..
69,4 hours ago,YouTube,Makan Bergizi Gratis,Pemerintah budeg sebudeg budegnya
70,4 hours ago,YouTube,Makan Bergizi Gratis,"Klwpun,g,di,hentikan,ksih,aja,uangnya,ke,guru2,,biar,di,pesankanan,sama,pemilik,warung,terdekat,itu,lebih,baik"
71,4 hours ago,YouTube,Makan Bergizi Gratis,"Transfer aja ke masing siswa 10rebu per hari, siswanya juga harus keluarha ekonomi ga mampu. Bisa lakikan pengecekan oleh petugas dulu apakah keluarga nya mampu apa tidak dengan cara cek rek, cek aset, rek listrik. Ataupun house visit. Dibatasi sampai SD saja. Yakin ini program dibawag 50 triliun doang. Bahkan bisa cuma 30 t"
72,4 hours ago,YouTube,Makan Bergizi Gratis,"Buktinya,dri,dlu,anak2,desa,alhmdulilah,sehat,smua,sampai,lulus,Mlah,smpai,kuliah,g,ad,yg,keracunan,jajanan,di,sekolah2"
73,4 hours ago,YouTube,Makan Bergizi Gratis,"Udah di level kayanya percuma deh kasih masukan ke pemerintah ujung2nya si pengkritik dibilang “antek asing” “dibayar” capek ,, padahal kita semua sayang sama pemerintah pengen punya pemerintah yang menyejahterakan,, 😢"
74,4 hours ago,YouTube,Makan Bergizi Gratis,upeti kami di makan tikus BGN
75,4 hours ago,YouTube,Makan Bergizi Gratis,"Yang jelas ini ladang korupsi Krn pengawasan lemah,,,dg bukti banyak temuan dilapangan tetapi tindakan lambat,,,,,negeri amburadul,,,masukan dan saran Tokoh, Rakyat, Mahasiswa tidak didengar,,,"
76,4 hours ago,YouTube,Makan Bergizi Gratis,"Sya,stju,skli,klw,ganti,dg,uang,biar,hnya,10,,,sehari"
77,4 hours ago,YouTube,Makan Bergizi Gratis,"Ini,di,jwa,timur,ibu2,,,dri,wali,murid,sudah,bosan,Krena,anak2,sudah,bosan,dg,mbg,di,skolah,JD,syang,klw,g,dikan,mka,lbih,baik,di,tutup,aj,ksih,uangnya,sja,lbih,aman,dn,jelass,gtu"
78,4 hours ago,YouTube,Makan Bergizi Gratis,Mbg jangan di perbaiki tapi hentikan. Tiadakan mbg seperti sebelum adanya lebih baik.
79,4 hours ago,YouTube,Makan Bergizi Gratis,Bukan program nya yang salah tapi manusianya yang rakus
80,4 hours ago (edited),YouTube,Makan Bergizi Gratis,Sebelum pelaku korupsi di hukum mati dari pusat sampai desa negara ngga akan maju. Sekalipun muslim  tapi tidak takut akhirat. Jadi yg tepat di berlakukan di indonesia korupsi di hukum mati baru pelaku korupsi takut.  Maka uang aman dg sendirinya negara baru maju.
81,4 hours ago,YouTube,Makan Bergizi Gratis,"Utk level sakit Indonesia saat ini, hukuman mati utk koruptor sepertinya sdh boleh di jalankan, para koruptor adalah pelanggar HAM berat"
82,4 hours ago,YouTube,Makan Bergizi Gratis,"Ga heran . . di t4 gw ada SPPG, tp gaada kegiatan sama sekali"
83,4 hours ago,YouTube,Makan Bergizi Gratis,Jawabannya SIBAPA simple EMANG GUE PIKIRIN....teriak teriak bocor tapi lubangnya ditambah lagi...mungkin beliau udah tua jadi balik lagi kayak bocil
84,4 hours ago,YouTube,Makan Bergizi Gratis,SEMAKIN MARAK JABATAN FIKTIF PROYEK FIKTIF KASUS FIKTIF GAJI FIKTIF BANTUAN FIKTIF ITU MODUS KORUPSI MANIPULASI YG BANYAK DI PEMERINTAHAN
85,4 hours ago,YouTube,Makan Bergizi Gratis,"Mohon presiden Prabowo merubah mekanisme MBG menjadi seperti KIP kartu Indonesia pintar.
Beri anak pelajar Kartu Makan Bergizi. Negara subsidi makan siang sebesar 15.000Rp dengan mengambil lewat ATM bank BRI. Lalu ibunya anak yang memasak atau membelikan nasi rames bergizi harga Rp15.000 sesuai selera makan anaknya."
86,4 hours ago,YouTube,Makan Bergizi Gratis,"Alhamdulillah berita seperti ini tetap ada, tidak malah dibungkam, tetap bisa menyuarakan 👏"
87,4 hours ago (edited),YouTube,Makan Bergizi Gratis,"MBG adalah tempatnya koropsi yg paling nyata ,karena minim banget pengawasan"
88,4 hours ago,YouTube,Makan Bergizi Gratis,"Kasihan keluarganya yg ikut program mbg menanghung dosa2 7 turunan,akibat ulah2 pemimpin yh serakah😊"
89,5 hours ago,YouTube,Makan Bergizi Gratis,"1. Korupsi pengadaan
2. Penjualan titik
3. SPPG fiktif. 
4. Spek SPPG yg tdk sesuai

4 item ini pasti di lalukan oleh ordal  harusnya ini bisa cepat ditindaklanjuti. 

Yayasan/Mitra nya gampang sekali utk dicari

4. Menu yang tek sesuai

Cek Mitra/yayasan dan Ka/AG dam AK nya. 

Jangan sampai SPPG yg amanah jadi kena imbasnya"
90,5 hours ago (edited),YouTube,Makan Bergizi Gratis,"Inti nya pemerintahan prabowo adalah  pemerintahan terkorup dalam sejarah indonesia, bahkan terangan terangan dan besar besaran juga ugel ugelan.. 

Mampu kah indonesia bertahan jika berjalan 2 periode

Daerah jakarta banyak SPPG yang baru dibuka, coba lah kirim petugasnya yang jujur untuk mengecek fakta di lapangan, apakah anak anak di jakarta banyak yang  terkena stunting ??? Kenapa kota sebesar jakarta juga banyak sekali SPPG..???

Ayoolah pak mohon hentikan MBG dan KMP nya. Selamatkan rakyat indonesia dari kehancuran ekonomi."
91,5 hours ago,YouTube,Makan Bergizi Gratis,"Pemerintah sudah Tuli, Bisu dan tertutup mata Hati-nya sehingga Negeri ini menuju kehancuran😡"
92,5 hours ago,YouTube,Makan Bergizi Gratis,Mbg kok ada investornya.. yg jelas ini bisnis bukan program bantuan....
93,5 hours ago,YouTube,Makan Bergizi Gratis,PROGRAM GERAKAN GEROMBOLAN DAJJAL PEMERINTAH MBG TOPENG YNG SANGAT TERANG BENDERANG PERAMPOKAN SELURUH KEKAYAAN NEGARA .UANG NEGARA DAN UANG RAKYAT STOP MBG.
94,5 hours ago,YouTube,Makan Bergizi Gratis,ayo masyarakat bangkit sadar dan awasi betul betul sppg yg ada di lingkungan masing masing... viral kan
95,5 hours ago,YouTube,Makan Bergizi Gratis,Dan presiden nya bilang Emang Gua Pikirin
96,5 hours ago,YouTube,Makan Bergizi Gratis,"Padahal tata kelola MBG sudah dikritik habis-habisan dari awal dilaksanakan, bahwa rawan korupsi, rawan diselewengkan, rawan KKN. Kan sekarang ketahuan, ada korupsi, dapur fiktif dan penyelewengan tata kelola. Pemimpin yang Ngeyel, egonya tinggi beginilah."
97,5 hours ago,YouTube,Makan Bergizi Gratis,"Tuhan, tolong selamatkan Indonesia..."
98,5 hours ago,YouTube,Makan Bergizi Gratis,Nasi di buang saja dana cair😂😂😂
99,5 hours ago,YouTube,Makan Bergizi Gratis,MBG paling enak buat KORUPTOR
100,5 hours ago,YouTube,Makan Bergizi Gratis,Makanya jgn menyalahkan mahasiswa demo krn mbg d.korosi besara2ran bru 2tahun sdh korosi s.bessar ini  makanya pemerentah skrang ambuar adull 😭😭😭😭😭😭😭
101,5 hours ago,YouTube,Makan Bergizi Gratis,Program MBG ini adalah tempat ladang korupsi...bu 5:58
102,5 hours ago,YouTube,Makan Bergizi Gratis,yg diuntungkan dari MBG adalah Prabowo dan kroni2 nya
103,5 hours ago,YouTube,Makan Bergizi Gratis,Bubarkan mbg
104,5 hours ago,YouTube,Makan Bergizi Gratis,"Kami emak dr anak yg menerima MBG setuju pendpt pakar itu,sangat sangat disayangkan mAkanan terbuang...MBG distop saat libur anak kami tetap makan 3x Shari,"
105,5 hours ago,YouTube,Makan Bergizi Gratis,"Tidak usah jadi provokator, sengkarutlah, proyek silumanlah, masiflah  Pemerintah lebih tau dari kamu2"
106,5 hours ago,YouTube,Makan Bergizi Gratis,"Klau kondisi titik area MBG fiktif maka Pemerintah tidak ada yg mengecek didaerah daerah.
Keputusannya :
Koruptor MBG harus di hukum mati.
Rekan kerja yg tidak memenuhi syarat harus di berhentikan.
Kontrol lagi area area MBG dari sabang sampai maroke.
Re Budget atau anggaran dan detail anggarannya harus dibuat dulu.

Harus dievaluasi lagi mengenai MBG. Dipeesiapkan oleh pemerintah lagi makanannya atau diberi uang setiap bulan ke murid dimasing masing sekolah.

Dengan melihat kondisi MBG sekarang."
107,5 hours ago,YouTube,Makan Bergizi Gratis,Sudah gila dan ga wajar. Hak rakyat diambilin terus oleh para maling dengan cara yg sangat diluar akal sehat. Lebih baik stop dan direncanakan ulang dengan baik dan pengawasan yg ketat
108,5 hours ago,YouTube,Makan Bergizi Gratis,"😂😂😂 udah d niat kan, program balas jasa buat para ternak2 balik modal 😂😂😂ternak foya2 bos ngalibur k ln, lama2 kabur lagi"
109,5 hours ago,YouTube,Makan Bergizi Gratis,"Makanan buat rakyat dijadikan proyek dan anggarannya dr APBN😂...parah ide siapa sih ini implementasi program mbg, kdmp dan danantara ...triki"
110,5 hours ago,YouTube,Makan Bergizi Gratis,"Coba kalau di percaya sama sekolah dan wali murid pasti biaya murah dan sampai murid, ngak usah banyak pekerja, dan makan prasmanan murid bisa milih"
111,5 hours ago,YouTube,Makan Bergizi Gratis,Klau mbg gk di tutp klau negarA ini bangkrut siapA yg tanggung jawab
112,5 hours ago,YouTube,Makan Bergizi Gratis,Mbg terlalu ribet lebih baik di tutup aja
113,6 hours ago,YouTube,Makan Bergizi Gratis,Kerusakan dimana lagi yg ingin kalian dustakan/ tutupi???!!?
114,6 hours ago,YouTube,Makan Bergizi Gratis,Program mbg ladang korupsi bikin susah rakyat.. Stop bayar pajak
115,6 hours ago,YouTube,Makan Bergizi Gratis,KASIAN..PRESIDEN....DIMANFAATIN AMA KORUPTOR....padahal..niatnya mah baik....harusnya hukum mati koruptor
116,6 hours ago,YouTube,Makan Bergizi Gratis,"Tidak ada yg epektip,baiknya MBG dihentikan,nggak ada gunanya yg ada potensinya,korupsi pekerjaan pembangunan pemerintah nggak ada cuma sibuk ngurusin MBG,80thn Indonesia nggak ada tu MBG,stanting juga cuma3%"
117,6 hours ago,YouTube,Makan Bergizi Gratis,Ga mungkin mau diundang lah mas...DPR..TNI..Polri...smua dpt jatah dapur..😂semua maling dilindungi presiden
118,6 hours ago,YouTube,Makan Bergizi Gratis,Proyek balas budi...
119,6 hours ago,YouTube,Makan Bergizi Gratis,"DI DAERAH KABUPATEN KAMI DI JATIM BANYAK YG FIKTIF.

MOHON SEGERA DIPERHATIKAN - DITELUSURI!"
120,6 hours ago,YouTube,Makan Bergizi Gratis,"Ini baru MBG, urusan lain juga banyak oknum minta fee, meskipun nilai kecil tapi masif, dan seakan akan jadi standar kalau berurusan dengan pemda/pemerintah"
121,6 hours ago,YouTube,Makan Bergizi Gratis,Program gila.😂
122,2 hours ago,YouTube,Makan Bergizi Gratis,Ini contoh orang yg otak ya jongkok
123,4 hours ago,YouTube,Makan Bergizi Gratis,modus lo gampang di kenali wokkkk !!!!
124,4 hours ago,YouTube,Makan Bergizi Gratis,"hey... para buzzer...  ayooo kerja lo, cebokin tuh mbg jgn cuman makan gaji buta !!!!!!"
125,5 hours ago,YouTube,Makan Bergizi Gratis,"Yg bertanggung jawab iya tedy, kan gara2 di kasih tedy yg ganteng rakyat lupa diri, sampai mentri, presiden ulang tahun aja di rayakan pemerintah"
126,6 hours ago,YouTube,Makan Bergizi Gratis,"Wahai pemerintah urusin gajih guru pppk dan guru honorer,,efek MBG itu jd gajih guru terbengkalai,sekolah juga terbengkalai banyak sekolah yg harus di renovasi tapi sulit anggaran..😢😢bentar kopdes deh bermasalah anggarannya."
127,6 hours ago,YouTube,Makan Bergizi Gratis,"Ndasmu emang gue pikirin 
Pemimpin ndableg statement nya selalu seperti itu jika di kritik tapi katanya tidak anti kritik tapi ketika dikritik berubah jadi kakek-kakek tempramen dasar monokotil"
128,6 hours ago,YouTube,Makan Bergizi Gratis,Mmg  deseinnya utk 2029
129,6 hours ago,YouTube,Makan Bergizi Gratis,PREEEEEEEET…………
130,6 hours ago,YouTube,Makan Bergizi Gratis,Iyyaa kenapa gak dihentikan dlu yah... Betul kata nya hebtikan dlulah
131,6 hours ago,YouTube,Makan Bergizi Gratis,"Emang udah rusak di sistem sejak awalnya, terus yg begini masih dibilang sukses programnya???"
132,6 hours ago,YouTube,Makan Bergizi Gratis,TERLALU KELIRU YG MAU MBG …..KATANYA GA PUNYA DANA…….KO MEMAKSA SIIIIIIIH RAKUS AMAT YAAAAA……DULU GA ADA MBG AMAN2 AJA TUUUUUH…………
133,6 hours ago,YouTube,Makan Bergizi Gratis,MBG dihentikan harga sembako jd turun ini bukti MBG sangat merusak
134,7 hours ago,YouTube,Makan Bergizi Gratis,BETUUUUL DIKIRIM KE ORANG TUANYA ….BIAR ORG TUA YG MASAK ……..ITU AKAN FRESH DAN TDK AKAN BASIIIII………ATAU STOP DULU BMG NYAAAAAAAAA…..
135,7 hours ago,YouTube,Makan Bergizi Gratis,LUCU BANGET YAAAA….TUKANG MASAK PAKAI BAJU KAYA DIREKTUR KANTOR …..NORAK BANGETNYAAAA……
136,7 hours ago,YouTube,Makan Bergizi Gratis,Yg dukung mbg sdm rendah
137,7 hours ago,YouTube,Makan Bergizi Gratis,"Kalau mau uang MBG diterima siswa 100% dan tidak dikorupsi, harus memakai caranya Bp.Ahok. Uangnya langsung ditransfer melalui bank ke orang tua murid."
138,7 hours ago,YouTube,Makan Bergizi Gratis,Presiden omon2
139,7 hours ago,YouTube,Makan Bergizi Gratis,"Sumber kericuhan di Indonesia dimulai sejak ada MBG dan KDMP.
Karena rakyat melihat, keduanya hanya proyek bagi2 APBN utk kroni partai/dpr/dprd/ormas dan TNI Polri. 
Siswa dan warga Desa hanya dijadikan alat utk mencairkan dana.
Presiden DIAM saja krn salah satu tujuannya adalah konsolidasi 2029.
Dadan cs hanya dijadikan peredam sesaat.
  
STOP MBG & KDMP!!!"
140,7 hours ago,YouTube,Makan Bergizi Gratis,Bubarkan MBG kopdes bubarkan di garong manusia serakah  menghancurkan negara sendiri oleh pemerintah saat ini pk Prabowo .Gibran yg plonga plongo
141,7 hours ago,YouTube,Makan Bergizi Gratis,"Ganti wowok, turunkan wowok, nepalkan wowok, semua terjadi karena setoran ke atas kurang"
142,7 hours ago,YouTube,Makan Bergizi Gratis,"Lebih baik MBG ganti dengan sekolah gratis bukan hanya spp tapi buku, seragam dan segala keperluan sekalah harus gratis. Karna banyak sekolah spp gratis tapi diganti spp menjadi infak"
143,7 hours ago,YouTube,Makan Bergizi Gratis,"MBG adalah Proyek.Ngawur, termasuk.Kopdes😂STOPPPPP"
144,7 hours ago,YouTube,Makan Bergizi Gratis,Program gak berkualitas
