id,tanggal,platform,topik,teks
659,44 minutes ago,YouTube,Makan Bergizi Gratis,"Satu lagi 😊 korupsi haji di sini pelakunya siapa saja sudah ditangkap semua belum? Korupsi MBG pelakunya siapa saja? Sudah ditangkap semua belum? Uang suap milyaran per hari diperoleh dari yayasan mana saja sudah disiplin beritanya belum? Sudah ada berita yayasan mana saja yang menyuap? Mana saja sppg yang menyuap? Mana saja sppg yg menynat porsi makanan demi menyediakan uang suap? Level yang korupsi apakah cuman bawahan, setahu saja levelnya adalah pucuk pimpinan BGN, yayasan, sppg yang artinya korupsi terjadi di semua level penyelenggaranya sampai ke pucuk pimpinan tertingginya dan saat ini masih diproses di kejaksaan dan belum terungkap semua. Artinya , masih banyak pelaku korupsi yg saat ini masih masuk dalam jajaran penyelenggara
Menurut ilmu pendidikan yg kamu pelajari apakah layak dijalankan?"
660,6 hours ago,YouTube,Makan Bergizi Gratis,proyek mana yg gk ada korupnya pak
661,31 minutes ago,YouTube,Makan Bergizi Gratis,​ @deffdos5319  dia kalo komen gk pake logika 😂
662,8 minutes ago,YouTube,Makan Bergizi Gratis,​ @deffdos5319 kamu spill saja dong proyek mana saja yg kamu curigai atau kamu ketahui ada praktik korupsi. Jgn ikut dgn akun yg sering komentar pendek2 tapi kalah logika debat akhirnya cmn menghina org
663,5 hours ago,YouTube,Makan Bergizi Gratis,Koruptorisme yg sebelum ini juga gak ditangkap kok...
664,4 hours ago,YouTube,Makan Bergizi Gratis,"Subsidi BBM aja korup, hentiin yuk klo berani"
665,34 minutes ago,YouTube,Makan Bergizi Gratis,"​ @sireeris9759 ya kamu spill dong sana ajukan laporan ke aparat. Meskipun sy cenderung setuju dgn ucapanmu tapi kamu harus tahu, sebanyak apapun bukti dan keterangan atau apapun itu semua hanya akan dianggap sebagai dugaan selama pihak otoritas tidak menyatakan itu praktik korupsi. Masih ingat Tiyo dan kritikus lain sewaktu MBG masih proses launch? Mereka semua SDH prediksi apa yg bakal terjadi yg artinya sudah menerapkan ilmu forecasting dan menganjurkan adanya sop ,juklak,juknis dsbnya yg memadai sebelum dilaksanakan. Tapi kamu tahu sendiri Khan kenyataannya seperti apa? Dulu anak2 masih bisa foto2 makanan yg diterima Krn tidak diancam dan dimarahi petugas sppg, skrg. Kita jadi tahu level penyelenggaraannya seperti apa. Ingat, meskipun kamu punya bukti banyak dan valid namun jika negara tidak menyatakan itu praktik korupsi maka itu bukanlah korupsi karena kamu tidak berkuasa untuk menyatakan itu sebagai korupsi"
666,22 minutes ago,YouTube,Makan Bergizi Gratis,"​ @sireeris9759  bangun jalan, bangun gedung, bangun jembatan juga ada indikasi korupsi 😂 tonton aja kdm 😂"
667,15 hours ago,YouTube,Makan Bergizi Gratis,Mendukung MBG berarti MENDUKUNG  KORUPTOR
668,13 hours ago,YouTube,Makan Bergizi Gratis,​ @tasmansindang7323 otak sempit dalam otak nya Taek melulu nich orang
669,9 hours ago,YouTube,Makan Bergizi Gratis,negara yang sakit adalah negara yang buta klo indonesia punya pemda yang selalu dapat anggaran wjwjw
670,5 hours ago,YouTube,Makan Bergizi Gratis,​ @Leon-dx4jc preet ..😅omon
671,15 hours ago,YouTube,Makan Bergizi Gratis," @tasmansindang7323  kata siapa ? sy bukan pejabat,sy cumak pedagang kecil sangat merasakan krna telur yg saya jual dibeli sama MBG"
672,16 hours ago,YouTube,Makan Bergizi Gratis,DPD INI APA PERNAH KUNJUNGAN KE DAERAH 3T? KLO TDK FAHAM DPD DOSA BESAR
673,16 hours ago,YouTube,Makan Bergizi Gratis,"😂😂😂😂 ini anggota DPD dari mana ini, makanya liat kebawah pak MBG itu membuat ekonomi berputar di daerah-daerah.... Mending hapus saja DPD gak jelas juga pungsinya😂😂😂"
674,16 hours ago,YouTube,Makan Bergizi Gratis,"Makan
Beracun
Goplokkk"
675,17 hours ago,YouTube,Makan Bergizi Gratis,Tetap semangat😮😮😮
676,17 hours ago (edited),YouTube,Makan Bergizi Gratis,"Anak anda bisa makan enak pak dari gajih pemerintah juga...
Apa salah nya sekarang uang di makan oleh anak sekolah dasar sampe menengah yg orang tuanya kurang mampu..
Soal korupsi.. orang mau niat korupsi mah pak g cuma di MBG.. di kementerian lagi juga bisa di korupsi.. 
Jangan egois pak, rakyat kecil itu butuh makan ..rugi amat kyk nya BPK ini anak2 makan enak setiap hari'..
Bukan uang pribadi pajak dari bapa aja..itu uang kami dari pajak juga.. jangan suka bawa rakyat rakyat yg mana..saya setuju anak2 bisa makan enak setiap hari..!"
677,17 hours ago,YouTube,Makan Bergizi Gratis,"Demi prut termon yg lapar dan rakus, mati2an d prtahankan, yg kna bncana mau jd pngemis pun no problem 😂😂😂 rezim luck nut"
678,17 hours ago,YouTube,Makan Bergizi Gratis,Kami bukan petani pak...kami petani merasakan betul efek mbg.....
679,17 hours ago,YouTube,Makan Bergizi Gratis,"MBG sarang koruptor, bikin anak-anak keracunan makanan....."
680,17 hours ago,YouTube,Makan Bergizi Gratis,Mending dihapus krn byk yg komplein
681,17 hours ago,YouTube,Makan Bergizi Gratis,MBG investasi Jaka panjang..programnya sangat berlian .Tapi sistemnya sangat kacau penuh korupsi dan nepotisme..
682,17 hours ago,YouTube,Makan Bergizi Gratis,"Bapak ini anaknya enak, kami didaerah perlu mbg, gak ada duit u. Jajan. Lanjutkan"
683,18 hours ago,YouTube,Makan Bergizi Gratis,"Anggaran indonesia ini Ratusan Triliun habis oleh MBG.
Kalau Ratusan Triliun itu di bangunkan ke Jalan perkebunan Masyarakat di Indonesia ini tentu Para Petani bisa mudah angkut Hasil Perkebunan."
684,18 hours ago,YouTube,Makan Bergizi Gratis,"Hentikan selamanya
Buat rakyat susah"
685,19 hours ago,YouTube,Makan Bergizi Gratis,"Orang tidak senang dengan program MBG, paling karena iri tidak mendapat job itu saja. sedikit sedikit bertanggung jawab sama Allah Swt seperti pendakwah saja. mana ada Allah Swt mengurusi MBG, Allah banyak kerjaan tidak cuma ngurusi MBG 😄 . Saya tidak mendapat MBG dan juga bukan pegawai MBG. saya melihat orang bisa bekerja dan mendapat MBG ikur senang saja ( tidak ada unsur apa apa ). MBG tidak perlu di hapus, tapi pengelolaannya saja yang di benahi supaya tertib dan baik itu baru solusi."
686,19 hours ago,YouTube,Makan Bergizi Gratis,"Betul sekali Pak MBG di bubarkan,kenapa anggaran sebesar itu tidak dipakai untuk mencintakan lapangan kerja,biar Prabowo tidak omon2 rakyat bituh makan doank pemikiran yan goblok"
687,19 hours ago,YouTube,Makan Bergizi Gratis,Sistim ny dulu di sempurnakan kalau masih seperti ini korupsi masih melajarela saya setuju deng DPD cek ulang dulu sistem
688,19 hours ago,YouTube,Makan Bergizi Gratis,"Itu yg teriak teriak ,karena gak kebagian jatah sppg😂😂😂"
689,19 hours ago,YouTube,Makan Bergizi Gratis,"Betul pak MBG ga ada gunanya pemborosan kl mau pakai duit kasihkan ke orang tuanya, betul tu idenya hotman paris"
690,19 hours ago,YouTube,Makan Bergizi Gratis,"MBG agar di lanjutkan siswa sekolah sangat membutuhkan,orang kaya mah udah makmur"
691,19 hours ago,YouTube,Makan Bergizi Gratis,"Gak usah MBG ,, sekolah gratis,,gaji guru naik,,,kuliah murah bagi otaknya yg brilian ,, itu aja juga bagus daripada MBG ,,uangnya tiap hari buat gemuk para koruptor aja"
692,5 hours ago,YouTube,Makan Bergizi Gratis,Anda seperti anak kecil yg gak tau uang 100rb trus dituker sama es krim mewah seharga 20rb tp anda pilih es krim.. Ngerti nggak ?
693,33 minutes ago,YouTube,Makan Bergizi Gratis,"emang efeknya apaan bg?? apakah harga2  melambung tinggi,, atau bbm naik,, atau yg mana nih efek yg abg mksd?"
694,2 hours ago,YouTube,Makan Bergizi Gratis,"Harusnya yg dikasih MBG hanya kebawah saja, klo masyarakat menengah keatas jangan dikasih, sisa dananya buat hal yg sangat prioritas.l, Contoh untuk pergerakan ekonomi dan pembangunan jalan."
695,18 hours ago,YouTube,Makan Bergizi Gratis,"Gk usah membawa rakyat,kmu sudah kaya tpi gk pernah mau bantu yg susah disekitarmu"
696,9 hours ago,YouTube,Makan Bergizi Gratis,lu susah karna males wkwk
697,15 hours ago,YouTube,Makan Bergizi Gratis,Yg senang mbg itu cecunguk koruptor
698,15 hours ago,YouTube,Makan Bergizi Gratis,Klo duitnya dikasih ke ortunya .dipastikan Malah gak dipakai untuk peningkatan makan bergizi buat Anak dan tidak menimbulkan efek domino penggerak ekonomi.
699,9 hours ago,YouTube,Makan Bergizi Gratis,ide hotmat? bro hotmat itu tetep dukung prabowo
700,2 hours ago,YouTube,Makan Bergizi Gratis,hentikan MBG  gak guna
701,19 hours ago,YouTube,Makan Bergizi Gratis,MBG waktu kampanye tdk dijanjikan kenapa ngotot. Rakyat milih tertipu.
702,19 hours ago,YouTube,Makan Bergizi Gratis,"Anggota dewan juga tidak peka terhadap bencana alam di Sumatra dan di sulut dll,mereka enak gaji DPR naik,tapi tidak pro rakyat,terbukti program Pak Prabowo Subianto dan mas Gibran mengawal MBG tidak di dukung,padahal MBG untuk rakyat miskin yang tidak mampu menikmati makanan dgn gizi baik"
703,19 hours ago,YouTube,Makan Bergizi Gratis,"Betul itu DPD , MBG ladang korupsi  ,tdk produktif ,pmborosan"". MBG boleh jika negara ini sudah ""MAPAN"" ,sedangkn negara masih morat marit ekonominy ,semua anggaran APBD d pangkas separo jg hny utk MBG  & MBG boleh ttp  khusus utk daerah2 tertinggal ,daerah2 miskin"", itu baru bener..."
704,19 hours ago,YouTube,Makan Bergizi Gratis,MBG itu bagus yang buat jelek pejabat yang korupsi
705,19 hours ago,YouTube,Makan Bergizi Gratis,Bohong PK Purbaya Prabowo GK cerdas tp tolol
706,19 hours ago,YouTube,Makan Bergizi Gratis,"Mbg hanya pake telor, bikin cerdas? Yg cerdas para koruptor😂😂😂😂"
707,19 hours ago,YouTube,Makan Bergizi Gratis,ACEH DAN PADANG TIDAK MEMILIH PRABOWO JUGA TIDAK MEMILIH JOKOWI KETIKA PILPRES JOKOWI DAN PRABOWO SELALU KALAH DI ACEH DAN PADANG KARENA WARGA ACEH DAN PADANG ANTI JAWA DARI JAMAN SUHARTO
708,19 hours ago,YouTube,Makan Bergizi Gratis,Prabowo yg bertanggung jwb dunia akhirat soal MBG...tunggu azab dari Allah
709,19 hours ago (edited),YouTube,Makan Bergizi Gratis,"MBG membuat generasi anak bangsa memiliki IQ tinggi-pintar pintar, ini yg ditakutkan SOROS. jika dialihkan yg mirip dgn konsep BLT maka kemunduran bagi Indonesia. TDK akanmemajukan dlm kecerdasan bangsa. Berilah saranpositif bagaimana pengelolaan MBG lebih baik."
710,19 hours ago,YouTube,Makan Bergizi Gratis,MEREKA IRI MELIHAT ORANG MEMBANTU RAKYAT MISKIN
711,19 hours ago,YouTube,Makan Bergizi Gratis,Dari partai mana tuh orang bego
712,19 hours ago,YouTube,Makan Bergizi Gratis,Stop MBG Krn lahan korupsi
713,19 hours ago,YouTube,Makan Bergizi Gratis,Tutup MBG bagus bapak
714,18 hours ago,YouTube,Makan Bergizi Gratis,"Mosok,yg kmu ikuti kampanya nya siapa 2024 kemarin"
715,5 hours ago,YouTube,Makan Bergizi Gratis,"Ibaratnya kita titip uang 100rb tp kita cuma diberi 20rb sisanya buat penitipan dan teman""nya..
Org yg protes ini ngerti harusnya kita punya 100rb itu klo bisa kembali 100rb syukur"" berbunga jd lbh"
716,24 minutes ago,YouTube,Makan Bergizi Gratis,MBG bukan hanya untuk rakyat miskin tapi rakyat menengah dan keatas pun tetap terima MBG di sekolah-sekola
717,13 hours ago,YouTube,Makan Bergizi Gratis,Nih orang dr Satuan Penjilat Prabowo Gibran. Jilat tuh sampai bersih. Jgn jilat bersih uang pajak rakyat.
718,9 hours ago,YouTube,Makan Bergizi Gratis, @pipitfitriyawati772  emang lu bayar pajak? lu lupa ya kalo indonesia tanpa sda bukan apa apa? wwkw
719,8 hours ago,YouTube,Makan Bergizi Gratis,"MBG cocok hanya murid yang tidak mampu atau daerah terpencil.....

Ini semua murid biar sekolah kaya d ksh jg MBG,, bagaimana mda jebol keuangan negara"
720,19 hours ago,YouTube,Makan Bergizi Gratis,Ini ini ini pemikiran yang blo on harusnya buat menciptakan lapangan pekerjaan biar tidak ada lagi kelaparan.Juga tidak ada korupsi yg buat rakyat muak.Goblok
721,17 hours ago,YouTube,Makan Bergizi Gratis,Termul ya apa saudara sppg
722,10 hours ago,YouTube,Makan Bergizi Gratis,"kau ini sebenarnya ngomong asal jeplak
dan kupastikan kau ini idiot"
723,15 hours ago,YouTube,Makan Bergizi Gratis,"Iq tinggi pintar2 bijimane?ada mbg dan gak ada mbg juga gak ada ngaruhnya buat bikin iq tinggi dan pintar2,,klw mau iq tinggi dan pintar2,noh pendidikan di tingkatkan bukan makan melulu."
724,9 hours ago (edited),YouTube,Makan Bergizi Gratis, @JohnBon-i2p   sama halnya lu doa kaya tapi lu gk usaha wwkwk lu makan gizi tapi lu gk belajar. mbg ladang korupsi harus di hentikan? sama halnya semua program pemerintah seperti haji juga korup harus di hentikan
725,13 hours ago,YouTube,Makan Bergizi Gratis,MBG pakai uang rakyat. Siapa yg bantu orang miskin? kecuali pakai uang pribadi Prabowo & Gibran.
726,9 hours ago,YouTube,Makan Bergizi Gratis, @pipitfitriyawati772  mbg pakai uang rakyat? negara lu tanpa sda bukan apa apa wkwk
727,18 hours ago,YouTube,Makan Bergizi Gratis,MBG masih dalam percobaan jadi kalau ada yg salah wajar
728,17 hours ago,YouTube,Makan Bergizi Gratis,​ @antek_antek_dajjal kuntul
729,7 hours ago,YouTube,Makan Bergizi Gratis,​ @antek_antek_dajjal wajar korupsi😂
730,16 seconds ago,YouTube,Makan Bergizi Gratis,Betul pak setujuu
731,3 minutes ago,YouTube,Makan Bergizi Gratis,Sangat Setuju....Baru tepat sasaran.
732,11 minutes ago,YouTube,Makan Bergizi Gratis,Setuju banget ini....jadi orang lebih ngerti yg pah maonya anak ..KLO MBG kan blm tentu anak tsb selera nya sama
733,19 minutes ago,YouTube,Makan Bergizi Gratis,Mantap bg...
734,21 minutes ago,YouTube,Makan Bergizi Gratis,setuju pk hotman ganti dengan rupiah tunai aja.langsung ke rekening org tua masing2..gk bs di korupsi tuh
735,24 minutes ago,YouTube,Makan Bergizi Gratis,"Kalo uang diserahkan ke ortu nya... Tdk akan dibelikan semua utk anaknya, biasanya utk belanja lainnya, ada juga yg utk judol, beli rokok, nyahur hutang dll, kalo lewat selolahan akn dipotong oleh guru nya"
736,28 minutes ago,YouTube,Makan Bergizi Gratis,Sangat setuju.pak.
737,29 minutes ago,YouTube,Makan Bergizi Gratis,Uang nya di beli kan paket data 😂
738,32 minutes ago,YouTube,Makan Bergizi Gratis,"Bukan ide baru, ahok sdh pernah ngomong."
739,1 hour ago,YouTube,Makan Bergizi Gratis,"Setuju, Krn KLO ttp bertahan dgn MBG makanan, khawatir Prabowo tenggelam dengan program unggulannya itu, Krn terlalu bnyk celah ruang korupsinya ketimbang manfaatnya."
740,1 hour ago,YouTube,Makan Bergizi Gratis,"Setuju ,dari pada di kasih makan GK di makan,lha GK enak masakan nya,"
741,1 hour ago,YouTube,Makan Bergizi Gratis,Betul betul betul  anak sd smp ibu hamil dan bayi
742,1 hour ago,YouTube,Makan Bergizi Gratis,MANTAP BRO HOTMAN. Bravo
743,1 hour ago,YouTube,Makan Bergizi Gratis,"Setuju sekali,lebih bermanfaat dan minim uang dimaling para koruptor biadab"
744,1 hour ago,YouTube,Makan Bergizi Gratis,Masuk
745,1 hour ago (edited),YouTube,Makan Bergizi Gratis,Bapa Prabowo itu sedang mengentaskan pengangguran melalui mbg ini. Mbg adalah peluang bagi NKRI untuk membantu rakyat jika perang dunia ke 3 terjadi. Jadi sebaiknya jngn diganti uang mending diganti yg korupsinya saja .
746,2 hours ago,YouTube,Makan Bergizi Gratis,Kalo mbg diganti uang nanti para pekerja yg menyiapkan mbg pada nganggur dong bang?!
747,2 hours ago,YouTube,Makan Bergizi Gratis,kalau memang negara mau ngasih makan rakyatnya bagikan saja uangnya kalau dibagikan uangnya setiap orang atau setiap warga negara bisa mendapatkan lebih dari 10jt pertahunnya bisa buat makan seharian gak gak cuma makan 1 kali sehari
748,2 hours ago,YouTube,Makan Bergizi Gratis,Betuuullll  sekali setuju
749,3 hours ago,YouTube,Makan Bergizi Gratis,Usilan ini baru benar
750,4 hours ago,YouTube,Makan Bergizi Gratis,Belum. Tentu. Orang. Tuanya. Faham. Mengenai. Gizi. Dan. Bagaimana. Cara. Auditnya
751,4 hours ago,YouTube,Makan Bergizi Gratis,Setuju...kerna orang tua yang tahu gizi untuk anaknya. Orang tua tak mungkin memberikan yg tidak baik untuk anaknya.
752,5 hours ago,YouTube,Makan Bergizi Gratis,Sangat setuju pak Hotman paris
753,5 hours ago,YouTube,Makan Bergizi Gratis,"Solusi 
Langsung bentuk uang ke orangtua. Itu bagus. 

Kasus orangtua mempergunakan ke hal lain itu jarang. Karna gk ada orang tua gk ngasih makan anaknya."
754,5 hours ago,YouTube,Makan Bergizi Gratis,Setuju
755,10 hours ago,YouTube,Makan Bergizi Gratis,"betul sekali kata bang hotman,lebih baik di serahkan orang tua,dan orang tua wajib membawakan bekal anaknya setiap hari .karna orang tua lebih tau yg baik buat anaknya ."
756,11 hours ago,YouTube,Makan Bergizi Gratis,"Betul pendapat Hotman. 
Akan tetapi Pak Wowo apa  menanggapi."
757,13 hours ago,YouTube,Makan Bergizi Gratis,Habis buat rokok bapaknya lah 😂
758,13 hours ago,YouTube,Makan Bergizi Gratis,BETUL BANGET ☝🏻
759,14 hours ago,YouTube,Makan Bergizi Gratis,Kalo di kelola dapur menu segitu yg gizi yg punya dapur
760,14 hours ago,YouTube,Makan Bergizi Gratis,Yg udah bangun dapur MBG pasti akan menentang nya.
761,14 hours ago,YouTube,Makan Bergizi Gratis,sangat setuju ...
762,14 hours ago,YouTube,Makan Bergizi Gratis,terimakasi pa hotman paris
763,14 hours ago,YouTube,Makan Bergizi Gratis,"Bosss.... 
DPR nanti Ribut.... 
Karna tak dapat tannnn... 
Pakek lahhhh OtAk Bossss... 
Merdekkkaaaa..."
764,14 hours ago,YouTube,Makan Bergizi Gratis,Tom.anjeri..siapa.yang.cepet.itu..yang.dapat..?
765,14 hours ago,YouTube,Makan Bergizi Gratis,Itu bukan bantuan gizi pak kalo berbentuk uang belom tentu jadi makanan bergizi malah uang nya pake bayar pinjol😂
766,14 hours ago,YouTube,Makan Bergizi Gratis,Setuju om❤❤❤
767,15 hours ago,YouTube,Makan Bergizi Gratis,Betulllll
768,15 hours ago,YouTube,Makan Bergizi Gratis,Setujuuuu banget
769,15 hours ago,YouTube,Makan Bergizi Gratis,Banyak yg bundir bg yg punya titik sppg 😂
770,15 hours ago,YouTube,Makan Bergizi Gratis,Byk orang pengangguran p
771,15 hours ago,YouTube,Makan Bergizi Gratis,G msk p .
772,15 hours ago,YouTube,Makan Bergizi Gratis,MBG.  Itu. Banyak. Bocor.  Bantuan Gisi. Ke seluruh. Rakyat.  Yang npunya. Tabungan. Di. Bank. Baru. Tidak. Di beri. Yang. Tidak. Punya. Tabungan di bank. Di. Beri semua. Belanjanya. Di koperasi. Agar. Tidak bocor. Dan koperasi. Akan berjalan. Itu. Lebih. Efektif dan mengena. Di. Masyarakat.  Atau. Tiap. KK. Kelas. Menengah ke bawah.
773,15 hours ago,YouTube,Makan Bergizi Gratis,Pak Hotman anda berpendapat salah kalau uang di berikan ke orang tua nya itu salah besar . Kalau uang di berikan ke orang tua nya tidak mungkin di belikan ke gizi anak nya dan manfaat tidak ke orang banyak .
774,15 hours ago,YouTube,Makan Bergizi Gratis,betul saya sokong pak
775,15 hours ago,YouTube,Makan Bergizi Gratis,Cocok & akor. Dengan sarat para penrima bikin rekening.
776,16 hours ago,YouTube,Makan Bergizi Gratis,Kalau di ganti uang ngga bisa di korupsi
777,16 hours ago,YouTube,Makan Bergizi Gratis,Solusi yg pernah di usulkan Ahok
778,16 hours ago,YouTube,Makan Bergizi Gratis,Mohon di dengar pak Prabowo saran dan masukan dari pak hotman❤❤❤
779,16 hours ago (edited),YouTube,Makan Bergizi Gratis,"Pak Hotman pasti belum pernah turun dan hidup di lingkungan orang tak mampu. Kalau MBG diganti uang, saya nggak yakin akan jadi gizi buat anak anak dan ibu hamil. Uangnya dapet, makannya tetep mie instant! Bukanya minum susu tapi dikasih teh! Kalau terjadi seperti itu apa tujuan membuat anak anak pintar karena dapat gizi tepat sasaran? Kecuali ada pengawasan langsung ke rumah penerima uang MBG, setiap hari cek menu makanan bergizi nya!"
780,16 hours ago,YouTube,Makan Bergizi Gratis,"Bah, udh gak tau diri si hotman bah"
781,16 hours ago,YouTube,Makan Bergizi Gratis,"Hayooo Bang bujuk terus masyarakat pasti setuju bgt,"
782,16 hours ago,YouTube,Makan Bergizi Gratis,Inisi ajarin orang miskin jadi korupsi bang hotman
783,16 hours ago,YouTube,Makan Bergizi Gratis,Lumayan buat bayar bank emok dan kosmetik😊😊😊
784,16 hours ago,YouTube,Makan Bergizi Gratis,Ini adalah pemikiran yg betul dan logika tapi para pejabat ya pening kalau programnya sistemnya betul maunya pejabat program yg gak betul alias haram itu yg dia suka
785,16 hours ago,YouTube,Makan Bergizi Gratis,Sangat setuju sekali❤❤❤
786,16 hours ago,YouTube,Makan Bergizi Gratis,SETUJU
787,17 hours ago,YouTube,Makan Bergizi Gratis,Makasih bang hotman sudah berani bersuara untuk kebaikan 🎉 anda memang pengacara terbaik 🎉
788,17 hours ago,YouTube,Makan Bergizi Gratis,Betul kt bg hotman.
789,17 hours ago,YouTube,Makan Bergizi Gratis,BETUL BAPAK HOTMAN KAMI SUKUNG ITU
790,17 hours ago,YouTube,Makan Bergizi Gratis,Setuju 👍
791,17 hours ago,YouTube,Makan Bergizi Gratis,Dipastikan uangnya untuk keperluan lainnya
792,17 hours ago,YouTube,Makan Bergizi Gratis,yg ada uang nya buat byr utang
793,17 hours ago,YouTube,Makan Bergizi Gratis,YAKIN USULAN DITOLAK.  NGGAK ADA YG DI KORUPSI DONG ???
794,17 hours ago,YouTube,Makan Bergizi Gratis,"Setuju Banget Bang Hotman 
Lebih Hemat Lagi
Tidak usah sewa Bangunan 
Tidak banyak Bayar Pekerja
Minim dikorupsi 
Karena sudah Tercantum Angkanya"
795,17 hours ago,YouTube,Makan Bergizi Gratis,Ekonomi petani dan nelayan gk kebantu
796,17 hours ago,YouTube,Makan Bergizi Gratis,SETUJU BAPAK HOTMAN
797,17 hours ago,YouTube,Makan Bergizi Gratis,"setuju mbg di ganti uang ,mungkin di setujui jika  yg usul  minimal 50% rakyat ri , kalau yg usul si Hotman mungkin di bilang interfensi alias  tuman"
798,17 hours ago,YouTube,Makan Bergizi Gratis,"Kmi dukung PK Hotman,,,yg setuju beri komentar,,,💪💪💪"
799,17 hours ago,YouTube,Makan Bergizi Gratis,Sangat setuju
800,17 hours ago,YouTube,Makan Bergizi Gratis,MBG KL tidak ikuti bank Hotman  berati benar2  hy untuk ajang korupsi
801,17 hours ago,YouTube,Makan Bergizi Gratis,"Betul.itu.. auto daya beli naik itu.. karna tiap orang tua pegang 
Uang.. klu sekarangbyg pegang uang cuma segelintir pemilik sppg"
802,17 hours ago,YouTube,Makan Bergizi Gratis,Mantap
803,17 hours ago,YouTube,Makan Bergizi Gratis,"Bentuk cess 
Eee yang pastinya buat nges looot"
804,17 hours ago,YouTube,Makan Bergizi Gratis,Mbg seakan menghancurkan ekonomi bangsa sendiri ini bahaya kalo tidak di setop ini bisa 2anggaran negara yg sangat besar bisa hancur
805,18 hours ago,YouTube,Makan Bergizi Gratis,Kalo ekonomi rakyat turun terus ini bisa2runtu dan bubar dan bisa2setip bayar pajak dari pada ekonomi rakyat hancur
806,18 hours ago,YouTube,Makan Bergizi Gratis,"Bukan perkara uang & gizi anak bang, fungsi dapur2 ini kedepannya bisa dialihfungsikan sebagai titik distribusi makanan Seandainya ada bencana alam / peperangan."
807,18 hours ago,YouTube,Makan Bergizi Gratis,Bung Hot.. orng desa dn awam itu mana tau makanan bergizi menunya sprti apa bung?
808,18 hours ago,YouTube,Makan Bergizi Gratis,Gk bisa dikorupsi man hotman
809,18 hours ago,YouTube,Makan Bergizi Gratis,"Sy ga setuju MBG diganti dgn uang karena nanti uang tsb pasti akn digunakan oleh orang tuanya si ank itu duitnya akn dipakai beli rokok,dipakai kondang,dipakai beli BBM  dipakai judol dll.?"
810,18 hours ago,YouTube,Makan Bergizi Gratis,"Kaalau pakai uang bisa untuk judol dan beli rokok, kalau mbg bisa buka lapangan kerja baru. Petani peternak pedagang dapat manfaatnya"
811,18 hours ago,YouTube,Makan Bergizi Gratis,Nah ini baru bener kasih uang tunai aja ke orang tuanya. Jadi ga usah ada proyek proyek sppg
812,18 hours ago,YouTube,Makan Bergizi Gratis,Susah didenger orng dah pada kongkalikong 😂😂😂
813,18 hours ago,YouTube,Makan Bergizi Gratis,"Saya setuju dengan pemikiran hormat....
Lalu pekerja MBG dipikirkan juga...
Punya solusi sampai tuntas jangan ngantung...gitu."
814,18 hours ago (edited),YouTube,Makan Bergizi Gratis,kasihan petani sama pekerja sppg
815,18 hours ago,YouTube,Makan Bergizi Gratis,"Lebih baik begitu. Jadi tdk akan ada korup N tdk memusingkan. Ortu lebih tau Gizi Anak. ❤❤ P Ahok, juga dari Awal bilang uang nya ksh ke Ortunya❤❤"
816,19 hours ago,YouTube,Makan Bergizi Gratis,Betul banggg
817,19 hours ago,YouTube,Makan Bergizi Gratis,"Nanti uangnya dipakai beli makanan yg tidak sesuai dengan yg mereka makan seperti program MBG,kalaian dikota selalu makan daginh, telur, dan munum susu, kalau kita yg dkampung kembali
makan seperti tahun2 yg lalu bahkan pulang sekolah baru makan, maka  makanan pokok sesuai daerah, enak bica dan usul tapi tidak tahu bagaimana rasanya makan makanan yg enak separti yg dikasi oleh pemeritah MBG"
818,19 hours ago,YouTube,Makan Bergizi Gratis,Kali ini saya setuju bang ...kasih dalam bentuk bantuan gizi dan siswa wajib bawa bekal ke sekolah.....ini baru top .....
819,19 hours ago,YouTube,Makan Bergizi Gratis,Rakyat pasti senang
820,19 hours ago,YouTube,Makan Bergizi Gratis,Setuju... Bang Hotman Negaraaan
821,19 hours ago (edited),YouTube,Makan Bergizi Gratis,Masuk pak e. Program unggulan tetap berjalan. Dan korupsi diperkecil. Biar ibu ibu yg beli langsung ke supplier petani dan pedagang langsung. Daripada dikorupsi
822,19 hours ago,YouTube,Makan Bergizi Gratis,"Buat bangun gedung mbg nya belum pulang modal pak, oknum  punya pemilik gedung rugi doooong😅"
823,19 hours ago,YouTube,Makan Bergizi Gratis,Itu nama nya enggak ada per putaran ekonomi...
824,19 hours ago,YouTube,Makan Bergizi Gratis,Rakyat kita ga siap pegang uang.. 😂
825,19 hours ago,YouTube,Makan Bergizi Gratis,❤❤❤❤❤❤ bang hotman pengacara kereennnnn hotman bijaksana pemikiranya
826,19 hours ago,YouTube,Makan Bergizi Gratis,Sepakat
827,19 hours ago,YouTube,Makan Bergizi Gratis,"MBG sulit dihentikan karena Keuntungannya  sangat besar bagi pemilik dapur dan pemilik dapur MBG banyak dikuasai oleh penjabat, DPR, polisi, TNI dan parpol Koalisi."
828,19 hours ago,YouTube,Makan Bergizi Gratis,Bener jg bang hotman kereen pemikirannya fress.....ayo bang lanjutkan nasihat mu
829,19 hours ago,YouTube,Makan Bergizi Gratis,"Pak, Hotman, buat gagasan ,itu bagus.."
830,19 hours ago,YouTube,Makan Bergizi Gratis,"Betul itu,Pak, Bapak Peduli Ke Anak didik."
831,19 hours ago,YouTube,Makan Bergizi Gratis,Setuju bang sangat bagus
832,19 hours ago,YouTube,Makan Bergizi Gratis,Setuju biar bisa buat byr spp
833,19 hours ago,YouTube,Makan Bergizi Gratis,gK bakal di dengrin pak hotman sma pak wowo nasehat ya
834,19 hours ago,YouTube,Makan Bergizi Gratis,S7 banget BG Hotman 👍❤️
835,19 hours ago,YouTube,Makan Bergizi Gratis,"Saya setuju,, bang"
